room_title,woe_room_url,review_id,review
"Escape room ""Rescue Pikachu"" by ASDF Escape in New Brunswick",https://worldofescapes.com/new-brunswick/quests/asdf-escape-rescue-pikachu,0,I can let Pikachu escape
"Escape room ""Rescue Pikachu"" by ASDF Escape in New Brunswick",https://worldofescapes.com/new-brunswick/quests/asdf-escape-rescue-pikachu,1,We did the Pikachu room with 7 people. Puzzles were generally good and only a couple of things were semi-arbitrary. We finished relatively quickly. Main complaints are that the atmosphere was disappointing and there should have been a max of 4 people in the room. I have also been to a much better escape room in DC.
"Escape room ""Rescue Pikachu"" by ASDF Escape in New Brunswick",https://worldofescapes.com/new-brunswick/quests/asdf-escape-rescue-pikachu,2,Kinda sketchy looking building and place. Thy did a good job putting together the room and clues but it wasn’t exactly professional looking - more like the upstairs of an old residential building with small rooms. 
"Escape room ""Rescue Pikachu"" by ASDF Escape in New Brunswick",https://worldofescapes.com/new-brunswick/quests/asdf-escape-rescue-pikachu,3,So much fun! The people running it were enthusiastic and upbeat and got us excited.
"Escape room ""Rescue Pikachu"" by ASDF Escape in New Brunswick",https://worldofescapes.com/new-brunswick/quests/asdf-escape-rescue-pikachu,4,GREAT place! Amazing staff and fun puzzles! Would recommend to do the Rescue Pikachu and Jail Bird rooms.
"Escape room ""Rescue Pikachu"" by ASDF Escape in New Brunswick",https://worldofescapes.com/new-brunswick/quests/asdf-escape-rescue-pikachu,5,"Pikachu room doesn't look like much but the look is deceiving! It was a little harder than I thought it would be. If not for my 11-year-old daughter, I wouldn't have even known where to begin, lol!"
