room_title,woe_room_url,review_id,review
"Escape room ""Island Escape"" by Breakout Games - Oklahoma City in Oklahoma City",https://worldofescapes.com/oklahoma-city/quests/breakout-games-oklahoma-city-island-escape,0,"This was a first visit to Breakout. We tried the island escape. It was a fun experience for all involved (ages 12 up to 77). It really did require working as a team to solve the clues (although we got some hints from Laura, who did a stellar job). This would even be great for companies as team building. Will definitely visit again."
"Escape room ""Island Escape"" by Breakout Games - Oklahoma City in Oklahoma City",https://worldofescapes.com/oklahoma-city/quests/breakout-games-oklahoma-city-island-escape,1,Lots of fun and great staff. My grandchildren enjoyed themselves and were engaged and intent on solving the mystery and were excited when we did with five seconds to spare.
"Escape room ""Island Escape"" by Breakout Games - Oklahoma City in Oklahoma City",https://worldofescapes.com/oklahoma-city/quests/breakout-games-oklahoma-city-island-escape,2,"My party of 4 and 2 other players completed the Island Escape in 57 min, really close! We really enjoyed the Game Master and his helpful hints when we would get stuck for a few min. Don’t be scared to ask for hints! This was all 6 of our first time doing an escape game and we loved it. Already thinking about which one we will do next. Great for a birthday or just going out for entertainment on a weekend."
"Escape room ""Island Escape"" by Breakout Games - Oklahoma City in Oklahoma City",https://worldofescapes.com/oklahoma-city/quests/breakout-games-oklahoma-city-island-escape,3,"Had a great time in the island escape room in okc. Big thanks to our game master Laura, she was awesome!"
"Escape room ""Island Escape"" by Breakout Games - Oklahoma City in Oklahoma City",https://worldofescapes.com/oklahoma-city/quests/breakout-games-oklahoma-city-island-escape,4,Really immersive and my group had a great time even though we didn't escape from Island Escape. We will definitely be back to take on Hostage!
