room_title,woe_room_url,review_id,review
"Escape room ""Island Escape"" by Breakout Games - Baltimore in Baltimore",https://worldofescapes.com/baltimore/quests/breakout-games-baltimore-island-escape,0,Great escape room! Had so much fun! I've done two here so far and plan to do more escape rooms in the future!
"Escape room ""Island Escape"" by Breakout Games - Baltimore in Baltimore",https://worldofescapes.com/baltimore/quests/breakout-games-baltimore-island-escape,1,Leslie was amazing and an awesome guide!
"Escape room ""Island Escape"" by Breakout Games - Baltimore in Baltimore",https://worldofescapes.com/baltimore/quests/breakout-games-baltimore-island-escape,2,Loved the experience had an amazing time! And Sean our game master was great. Will return in the future.
"Escape room ""Island Escape"" by Breakout Games - Baltimore in Baltimore",https://worldofescapes.com/baltimore/quests/breakout-games-baltimore-island-escape,3,We love the Breakout games in Columba so we tried to give the Timonium location a try. The Island Escape room was really fun and we had a great time! The staff was very friendly as well!
"Escape room ""Island Escape"" by Breakout Games - Baltimore in Baltimore",https://worldofescapes.com/baltimore/quests/breakout-games-baltimore-island-escape,4,"By far the best experience I've had doing escape rooms. The staff was friendly and welcoming. We did two rooms in one day, and both were very well planned out. The volcano room was amazing!"
