room_title,woe_room_url,review_id,review
"Escape room ""The Kidnapping"" by Breakout Games - Chattanooga in Chattanooga",https://worldofescapes.com/chattanooga/quests/Breakout-Chattanooga-The-Kidnapping,0,"We have been to several locations to do escape rooms, and this is one of our favorites. We loved the Kidnapping!"
"Escape room ""The Kidnapping"" by Breakout Games - Chattanooga in Chattanooga",https://worldofescapes.com/chattanooga/quests/Breakout-Chattanooga-The-Kidnapping,1,"We did the kidnapping game on our trip. The game was challenging, intriguing, and very well put together. It is well worth the price. Not very expensive, and makes for a much more fun night than going to the movies. Highly recommended."
"Escape room ""The Kidnapping"" by Breakout Games - Chattanooga in Chattanooga",https://worldofescapes.com/chattanooga/quests/Breakout-Chattanooga-The-Kidnapping,2,"We just did the kidnapping room and it was amazing!!!! We almost made it out, we had the exit code then changed it the last minute then ran out of time! But Patrick is the best person there! I definitely will be trying to do the other rooms!"
"Escape room ""The Kidnapping"" by Breakout Games - Chattanooga in Chattanooga",https://worldofescapes.com/chattanooga/quests/Breakout-Chattanooga-The-Kidnapping,3,Awesome time ! Watch your head !Great staff very friendly! Also coffee is on point .
"Escape room ""The Kidnapping"" by Breakout Games - Chattanooga in Chattanooga",https://worldofescapes.com/chattanooga/quests/Breakout-Chattanooga-The-Kidnapping,4,"Guys, if you haven't been yet, you absolutely need to go experience Breakout Chattanooga. It was absolutely the most fun we've had in a long time. Great for a date night or a large group of friends. And to top it off, we got to see a great old lifelong friend who has put together the coolest place in town!"
