room_title,woe_room_url,review_id,review
"Escape room ""Happy Campers"" by Epic Escape Game in Denver",https://worldofescapes.com/denver/quests/epic-escape-game-happy-campers,0,Went with our friends and tried to escape the Camping Room. The hour flew by and before you know it our time was up! Didn't escape this time... but we all said we can't wait to try another room soon.
"Escape room ""Happy Campers"" by Epic Escape Game in Denver",https://worldofescapes.com/denver/quests/epic-escape-game-happy-campers,1,So much fun! We did the Happy Camper room. We didn't escape but we really enjoyed working through the clues. We absolutely recommend doing this if you are looking for something fun to do in Castle Rock!
"Escape room ""Happy Campers"" by Epic Escape Game in Denver",https://worldofescapes.com/denver/quests/epic-escape-game-happy-campers,2,"So much fun! They have five exciting escape room themes to choose from. My group did “Happy Campers”, which we almost didn’t escape from — we had to burn our hints/clues to help us! Can’t wait to go back and try the other four."
"Escape room ""Happy Campers"" by Epic Escape Game in Denver",https://worldofescapes.com/denver/quests/epic-escape-game-happy-campers,3,"Excellent entertainment for the entire family. With four adults and three kids, we escaped the Happy Campers room with only 40 seconds to spare. Can't wait to try another room!"
"Escape room ""Happy Campers"" by Epic Escape Game in Denver",https://worldofescapes.com/denver/quests/epic-escape-game-happy-campers,4,We had a blast this morning with the “Happy Campers” room! It was a fun challenge and it came down to the last few minutes for us to escape. I look forward to trying out the other four rooms!!! We’ll be back again soon!
