room_title,woe_room_url,review_id,review
"Escape room ""Espionage"" by Escape Room Florence in Florence (AL)",https://worldofescapes.com/florence-al/quests/escape-room-florence-espionage,0,We tried the Espionage room. It was a great experience for our first escape room try. The kids enjoyed helping with the clues. We all worked together and used our 3 hint helps to escape.
"Escape room ""Espionage"" by Escape Room Florence in Florence (AL)",https://worldofescapes.com/florence-al/quests/escape-room-florence-espionage,1,"We had a great time !!!! Escaped ""Espionage"" with approx 20 seconds left. A lot more challenging than we anticipated. We will definitely go back soon to attempt Lost Cabin. Highly recommend these guys at Escape Room ... Great overall experience"
"Escape room ""Espionage"" by Escape Room Florence in Florence (AL)",https://worldofescapes.com/florence-al/quests/escape-room-florence-espionage,2,We had an awesome time! We did the Espionage room. I highly recommend it to anyone who likes to solve puzzles. We can't wait to do another one!
"Escape room ""Espionage"" by Escape Room Florence in Florence (AL)",https://worldofescapes.com/florence-al/quests/escape-room-florence-espionage,3,"We loved the escape room! We did the espionage room, and it was a lot of fun! It keeps you thinking and putting together clues you find the entire time! Can't wait to try out their other rooms!"
"Escape room ""Espionage"" by Escape Room Florence in Florence (AL)",https://worldofescapes.com/florence-al/quests/escape-room-florence-espionage,4,Had a great time at the Escape Room!! We escaped the Espionage Room with 19 seconds left. This is a great place for family & friends. Staff was friendly & helpful throughout the experience. Looking forward to returning to try out the Cabin Room.
