room_title,woe_room_url,review_id,review
"Escape room ""Theft of the Texas Lone Star"" by Escape Hunt in Houston",https://worldofescapes.com/houston/quests/escape-hunt-h-theft-of-the-texas-lone-star,0,We had so much fun! The employees were engaging and helpful. The innovative and intriguing puzzles made the hour fly by. I can't wait to try another escape!
"Escape room ""Theft of the Texas Lone Star"" by Escape Hunt in Houston",https://worldofescapes.com/houston/quests/escape-hunt-h-theft-of-the-texas-lone-star,1,Highly recommended. Need to have your thinking cap on!
"Escape room ""Theft of the Texas Lone Star"" by Escape Hunt in Houston",https://worldofescapes.com/houston/quests/escape-hunt-h-theft-of-the-texas-lone-star,2,"Had a great time in the Theft of the Lone Star room. It was moderate difficulty and suited our party of five well. Our game master was great - very detailed, very funny and patient with us. We will definitely be coming back soon."
"Escape room ""Theft of the Texas Lone Star"" by Escape Hunt in Houston",https://worldofescapes.com/houston/quests/escape-hunt-h-theft-of-the-texas-lone-star,3,"Came here with my wife, kids and in laws. We did the Lone Star room and had a blast! It was challenging and full of surprises. Highly recommend for a fun night out."
"Escape room ""Theft of the Texas Lone Star"" by Escape Hunt in Houston",https://worldofescapes.com/houston/quests/escape-hunt-h-theft-of-the-texas-lone-star,4,"I booked this event for my office and let me tell you...We had a great time! I'd done an escape room before at Escape Now and this was wayyy better! The Theft at Lonestar was fun and challenging, but not so hard to the point it's not enjoyable. Had a blast!"
