room_title,woe_room_url,review_id,review
"Escape room ""Dr. Stein's Laboratory"" by Escape Room Pittsburgh in Pittsburgh",https://worldofescapes.com/pittsburgh/quests/Escape-Room-PittsburghDr-Stein-s-Laboratory,0,"What a great time! ! The staff was awsome, they were really into it and that made it even more fun! I think this is guaranteed to be a fun night out for anyone who does it!!"
"Escape room ""Dr. Stein's Laboratory"" by Escape Room Pittsburgh in Pittsburgh",https://worldofescapes.com/pittsburgh/quests/Escape-Room-PittsburghDr-Stein-s-Laboratory,1,Fabulous time! I booked the entire Mad Scientist room for my daughter and her friends for her 17th bday and the had a blast! They loved the entire experience & can't wait to do it again for the next birthday!! Fun times!
"Escape room ""Dr. Stein's Laboratory"" by Escape Room Pittsburgh in Pittsburgh",https://worldofescapes.com/pittsburgh/quests/Escape-Room-PittsburghDr-Stein-s-Laboratory,2,So fun!! Such an unforgettable expierence. Can't wait to go back and try another room!!
"Escape room ""Dr. Stein's Laboratory"" by Escape Room Pittsburgh in Pittsburgh",https://worldofescapes.com/pittsburgh/quests/Escape-Room-PittsburghDr-Stein-s-Laboratory,3,Had such a great time tonight! Even though we did not escape! Looking fwd to the new place in the waterfront!
"Escape room ""Dr. Stein's Laboratory"" by Escape Room Pittsburgh in Pittsburgh",https://worldofescapes.com/pittsburgh/quests/Escape-Room-PittsburghDr-Stein-s-Laboratory,4,Had a blast...the magnet was strong enough...Can't wait to try all the other rooms...
"Escape room ""Dr. Stein's Laboratory"" by Escape Room Pittsburgh in Pittsburgh",https://worldofescapes.com/pittsburgh/quests/Escape-Room-PittsburghDr-Stein-s-Laboratory,5,My teenage kids wanted to try it and even though we didn't get out it was a blast trying. The saying time flys when your having fun is so true. Can't wait to try the other room.
"Escape room ""Dr. Stein's Laboratory"" by Escape Room Pittsburgh in Pittsburgh",https://worldofescapes.com/pittsburgh/quests/Escape-Room-PittsburghDr-Stein-s-Laboratory,6,We got a group of 14 together and split up over both rooms. Everyone had a great time and really enjoyed the night of puzzles and teamwork. Highly recommend this to everyone!
