room_title,woe_room_url,review_id,review
"Escape room ""Metro Mayhem"" by Masterpiece Escapes in Charlotte",https://worldofescapes.com/charlotte/quests/masterpiece-escapes-metro-mayhem,0,Friendly staff and just the right amount of challenging puzzles. Metro Mayhem room was fun for the whole family!
"Escape room ""Metro Mayhem"" by Masterpiece Escapes in Charlotte",https://worldofescapes.com/charlotte/quests/masterpiece-escapes-metro-mayhem,1,Different types of clues and ways to solve the mystery. We did the Mad Scientist room and it turned out to be multiple rooms. It had unique puzzles to solve and interact with. Very enjoyable and I highly recommend this place!
"Escape room ""Metro Mayhem"" by Masterpiece Escapes in Charlotte",https://worldofescapes.com/charlotte/quests/masterpiece-escapes-metro-mayhem,2,Did an escape room at Masterpiece Escapes with friends. We managed to solve it and save the city from Dr. Devastation.
"Escape room ""Metro Mayhem"" by Masterpiece Escapes in Charlotte",https://worldofescapes.com/charlotte/quests/masterpiece-escapes-metro-mayhem,3,My family and I had a wonderful experience defeating Dr Devistation. The puzzles are very creative and the atmosphere is very exciting.
"Escape room ""Metro Mayhem"" by Masterpiece Escapes in Charlotte",https://worldofescapes.com/charlotte/quests/masterpiece-escapes-metro-mayhem,4,"I brought some of my employees here to take on Doctor Devastation and his shenanigans. WHAT A BLAST! Thanks for a good time, looking forward to more rooms!"
