room_title,woe_room_url,review_id,review
"Escape room ""Escape the Aliens"" by Ryptic Room Escape in San Francisco",https://worldofescapes.com/sfbay/quests/ryptic-room-escape-escape-from-the-aliens,0,"The puzzles were complex and really made you think, yet nothing felt impossible. The clues are quite solid and it was lot of fun to see how everything was connected. It was a great experience - highly recommend!"
"Escape room ""Escape the Aliens"" by Ryptic Room Escape in San Francisco",https://worldofescapes.com/sfbay/quests/ryptic-room-escape-escape-from-the-aliens,1,We had a completely awesome time escaping. The building is a perfect setting and the puzzles were challenging without being impossible.
"Escape room ""Escape the Aliens"" by Ryptic Room Escape in San Francisco",https://worldofescapes.com/sfbay/quests/ryptic-room-escape-escape-from-the-aliens,2,"I had such a great time escaping the room here! It's a great team bonding event and I highly recommend it to everyone to try it out. The story and puzzles are carefully thought out so you'll definitely be motivated to work together to find all the clues. I have only done one other escape the room before, but this one was definitely my favorite. You won't regret it!"
"Escape room ""Escape the Aliens"" by Ryptic Room Escape in San Francisco",https://worldofescapes.com/sfbay/quests/ryptic-room-escape-escape-from-the-aliens,3,"Went with a group of friends to celebrate my birthday. Everyone had a blast. The gamemaster was timely, friendly, and informative. It escape was challenging enough to be fun but not so challenging to be frustrating. We are planning to return to attempt the second room once it opens."
"Escape room ""Escape the Aliens"" by Ryptic Room Escape in San Francisco",https://worldofescapes.com/sfbay/quests/ryptic-room-escape-escape-from-the-aliens,4,"We had lots of fun. The Alien escape is a great mental challenge which we weren't able to solve. Our host, Bob, was great! I highly recommend this place."
"Escape room ""Escape the Aliens"" by Ryptic Room Escape in San Francisco",https://worldofescapes.com/sfbay/quests/ryptic-room-escape-escape-from-the-aliens,5,"A mixture of hunting and solving skills, along with teamwork. The puzzles were just challenging enough, especially given the time constraint. It was a lot of fun, and definitely worth doing again when new challenges become available."
"Escape room ""Escape the Aliens"" by Ryptic Room Escape in San Francisco",https://worldofescapes.com/sfbay/quests/ryptic-room-escape-escape-from-the-aliens,6,This was our 3rd time doing something like this and by far our best experience. Our 'guide' was awesome. He made sure we were all engaged and gave us just the right amount of encouragement. Highly recommend this to anyone who likes puzzles.
