room_title,woe_room_url,review_id,review
"Escape room ""The Asylum"" by Source Code Escape Games in Augusta",https://worldofescapes.com/augusta/quests/source-code-escape-games-the-asylum,0,So much fun! We did Asylum and it was the best part of our weekend. Can’t wait for the next room to come out!
"Escape room ""The Asylum"" by Source Code Escape Games in Augusta",https://worldofescapes.com/augusta/quests/source-code-escape-games-the-asylum,1,"Great time at a unique escape room. I have been to probably 20 escape rooms, and their Asylum is definitely in my top 3 I have done. It was creative and not just a bunch of lock and keys, but had a cool quirky fun theme with some neat little twists."
"Escape room ""The Asylum"" by Source Code Escape Games in Augusta",https://worldofescapes.com/augusta/quests/source-code-escape-games-the-asylum,2,"Such a fun place! Got to help cure the haunting in the asylum, and then threw axes for a bit. Staff was friendly and great, can't wait to come back for their future events."
"Escape room ""The Asylum"" by Source Code Escape Games in Augusta",https://worldofescapes.com/augusta/quests/source-code-escape-games-the-asylum,3,Had an amazing time! Done quite a few different ones and this is definitely one of my favorites. They have plenty of little intricacies that immerse you in the game. Will definitely be back when the next one opens!
"Escape room ""The Asylum"" by Source Code Escape Games in Augusta",https://worldofescapes.com/augusta/quests/source-code-escape-games-the-asylum,4,I have done a handful of escape rooms and this one is by far my favorite. I can't wait for the new puzzle to open!
