room_title,woe_room_url,review_id,review
"Escape room ""A Night at the Castle"" by The Escape Room Fishers in Indianapolis",https://worldofescapes.com/indianapolis/quests/the-escape-room-fishers-a-night-at-the-castle,0,"We escaped from the castle. It was a great experience - lots of intricacies, rooms, and steps (literally, steps). Delani was really helpful and super positive and enthusiastic. We all enjoyed our evening at the castle. The Escape Room has good quality rooms!"
"Escape room ""A Night at the Castle"" by The Escape Room Fishers in Indianapolis",https://worldofescapes.com/indianapolis/quests/the-escape-room-fishers-a-night-at-the-castle,1,The Neuschwanstein Castle room was very immersive and kept us guessing throughout the entire hour. I highly recommend this room and ask for jester jake if you want a great room master. He did a great job in making it fun and interesting!
"Escape room ""A Night at the Castle"" by The Escape Room Fishers in Indianapolis",https://worldofescapes.com/indianapolis/quests/the-escape-room-fishers-a-night-at-the-castle,2,"We had a great time! We escaped the castle! Thank you medieval Megan, you were a great game master!"
"Escape room ""A Night at the Castle"" by The Escape Room Fishers in Indianapolis",https://worldofescapes.com/indianapolis/quests/the-escape-room-fishers-a-night-at-the-castle,3,Had a great time at the Castle today. Maggie did a great job and was very helpful!
"Escape room ""A Night at the Castle"" by The Escape Room Fishers in Indianapolis",https://worldofescapes.com/indianapolis/quests/the-escape-room-fishers-a-night-at-the-castle,4,"This was our third time in an escape room and it was by far the best one! We did the Night In The Castle and it was a great time, the staff did a great job and we definitely enjoyed it."
