room_title,woe_room_url,review_id,review
"Escape room ""Prison Break"" by The Escape Game Las Vegas in Las Vegas",https://worldofescapes.com/las-vegas/quests/the-escape-game-las-vegas-prison-break,0,Definitely was the great ! We bring my friends go this again. Would recommend everybody come down & enjoy it most satisfied.
"Escape room ""Prison Break"" by The Escape Game Las Vegas in Las Vegas",https://worldofescapes.com/las-vegas/quests/the-escape-game-las-vegas-prison-break,1,Prison Break was a great game. Will def. come back to try the others! 5 stars! Love love love! I’m bringing all of my friends.
"Escape room ""Prison Break"" by The Escape Game Las Vegas in Las Vegas",https://worldofescapes.com/las-vegas/quests/the-escape-game-las-vegas-prison-break,2,Had a lot of fun with the Prison break room! Just when we thought we were free there was more to do! Loved the puzzles and how you really needed team work.
"Escape room ""Prison Break"" by The Escape Game Las Vegas in Las Vegas",https://worldofescapes.com/las-vegas/quests/the-escape-game-las-vegas-prison-break,3,"Very great experience! Tried the prison break escape room, with my coworkers! Had a blast! There are four different rooms, prison break is the hardest room! And we surpassed it as a team! This was my first escape room, and I had so much fun! I look forward to trying my next escape room here!"
"Escape room ""Prison Break"" by The Escape Game Las Vegas in Las Vegas",https://worldofescapes.com/las-vegas/quests/the-escape-game-las-vegas-prison-break,4,Awesome we had blast. The employee's were friendly and helpful. JD the manager is awesome. And we beat it with one second on the clock.
