room_title,woe_room_url,room_address,room_description,player_range,time_limit,difficulty_level,fear_level,age_requirement,success_rate
"Escape room ""The Hacker of Silicon Valley"" by BreakoutStudios in San Jose",https://worldofescapes.com/san-jose/quests/breakoutstudios-the-hacker-of-silicon-valley,"99 N 1st St #225 San Jose, CA 95113","Silicon Valley is attracting some of the smartest engineers from around the globe, who are working on innovative solutions that are changing the world.

One such person has become known as “The Hacker of Silicon Valley” for creating advanced solutions. The real identity of this hacker is only known by a few.

The Hacker of Silicon Valley has gone missing in the future. It’s believed that the hacker has made a major breakthrough that could change the world; and many foreign organizations are determined to steal the work.

Your mission is to travel two years into the future to the hacker’s last secret hideout, find the encrypted code, communicate with the hacker, and upload the work to the company that owns it and will use it for the greater good of humanity.

You have 60 minutes to complete this mission
",3-7,60,Average,Not scary,,None
