room_title,woe_room_url,room_address,room_description,player_range,time_limit,difficulty_level,fear_level,age_requirement,success_rate
"Escape room ""Autopsy"" by Crystal River Room Escape in Crystal River",https://worldofescapes.com/crystal-river/quests/crystal-river-room-escape-autopsy,"8740 Mayo Drive Suite #5 Crystal River, FL 34429","In the Autopsy you have 2 jobs – ESCAPE the room and solve a murder mystery.
Headquarters has been investigating the disappearance of Donald the Barber from our Barbershop.
Donald has been missing for some time now and things are not quite right in the Autopsy Room.
So headquarters has sent you in to solve the case. Since the disappearance of Donald the Autopsy has been heavily guarded, with the guards only leaving during lunch.
This means you have 1 hour to figure out the mystery and Escape.  Remember you are working undercover so it is very important you fit in,  slip on a lab coat and look official. The clock is ticking!!!",2-6,60,Average,Not scary,,None
