room_title,woe_room_url,room_address,room_description,player_range,time_limit,difficulty_level,fear_level,age_requirement,success_rate
"Escape room ""The Pirate Hunter"" by Vizzini's House of Escapes in Salt Lake City",https://worldofescapes.com/slc/quests/vizzinis-house-of-escapes-the-pirate-hunter,"229 W Main St American Fork, UT 84003","Two Ways to Experience...

Groups of 4-6 can experience the Pirate Hunter series as two separate 90-minute games.

Only after playing the Key to Queen Anne's Treasure will you be invited to return and play The Ruby Skull. 

Larger groups will take on the search for both Anne's Key and the Ruby Skull simultaneously.  

Locate both priceless artifacts to protect the location of a sunken pirate ship before a greedy government claims the unimaginable treasure as its own. ",4-12,60,Average,Not scary,,None
