room_title,woe_room_url,room_address,room_description,player_range,time_limit,difficulty_level,fear_level,age_requirement,success_rate
"Escape room ""Calico Jack's Lost Treasure"" by Xtreme Escape Game in Marco Island",https://worldofescapes.com/marco-island/quests/Xtreme-Escape-Game-Calico-Jacks-Lost-Treasure,"909 North Collier Boulevard, Marco Island, FL 32084","All hands on deck!
You have been captured by Calico Jack's crew off the coast of the 10,000 Islands. 
You are being held captive on his Pirate Ship.
Somewhere on the ship there is a long lost treasure.  Finding it will set you free.
You only have 60 minutes before it's time fer ye to walk the plank!",2-8,60,Average,None,,None
