state,city,company_and_room,woe_room_url
Florida,Orlando,The Escape Game: The Heist,https://worldofescapes.com/orlando/quests/The-Escape-Game-Orlando-The-Heist
Florida,Orlando,The Escape Game: Special Ops: Mysterious Market,https://worldofescapes.com/orlando/quests/the-escape-game-orlando-special-ops
Florida,Orlando,The Escape Game: Mission: Mars,https://worldofescapes.com/orlando/quests/the-escape-game-orlando-mission-mars
Florida,Orlando,The Escape Game: Gold Rush,https://worldofescapes.com/orlando/quests/the-escape-game-orlando-gold-rush
Florida,Orlando,The Escape Game: Playground,https://worldofescapes.com/orlando/quests/the-escape-game-orlando-playground
Florida,Orlando,The Escape Game: Team Building Opportunities,https://worldofescapes.com/orlando/quests/the-escape-game-orlando-team-building-opportunities
Florida,Orlando,The Escape Game: Escape Game Iron Gate,https://worldofescapes.com/orlando/quests/the-escape-game-orlando-escape-game-iron-gate
Florida,Orlando,The Escape Game: Remote Adventures,https://worldofescapes.com/orlando/quests/the-escape-game-orlando-remote-adventures
Florida,Orlando,The Escape Game: TEG Unlocked: The Heist - Vol. 1: Chasing Hahn [DIGITAL],https://worldofescapes.com/orlando/quests/the-escape-game-orlando-teg-unlocked-the-heist-vol-1-chasing-hahn-digital
Florida,Orlando,"""Doldrick's Escape Room"": Spoopy's Ghoulish Graveyard Gameshow",https://worldofescapes.com/orlando/quests/doldricks-escape-room-spoopys-ghoulish-graveyard-gameshow
Florida,Orlando,"""Doldrick's Escape Room"": Red Sled Redemption at the Holly Jolly Holiday Hubcap Repair",https://worldofescapes.com/orlando/quests/doldricks-escape-room-red-sled-redemption-at-the-holly-jolly-holiday-hubcap-repair
Florida,Orlando,"""Doldrick's Escape Room"": Super Bomb Squad: Commandos Awesome",https://worldofescapes.com/orlando/quests/doldricks-escape-room-super-bomb-squad-commandos-awesome
Florida,Orlando,Escapology: Scooby-Doo,https://worldofescapes.com/orlando/quests/Escapology-Cuban-Crisis
Florida,Orlando,"""America's Escape Game"": The Caretaker",https://worldofescapes.com/orlando/quests/America-s-Escape-Game-THE-CARETAKER
Florida,Orlando,Escapology: Budapest Express,https://worldofescapes.com/orlando/quests/Escapology-BUDAPEST-EXPRESS
Florida,Orlando,"""America's Escape Game"": Crisis at 1600",https://worldofescapes.com/orlando/quests/America-s-Escape-Game-Crisis-at-1600
Florida,Orlando,Escapology: Antidote,https://worldofescapes.com/orlando/quests/Escapology-ANTIDOTE
Florida,Orlando,"""America's Escape Game"": Pandemic",https://worldofescapes.com/orlando/quests/America-s-Escape-Game-Pandemic
Florida,Orlando,Escape Goat: The Quest,https://worldofescapes.com/orlando/quests/escape-goat-the-quest
Florida,Orlando,Breakout Escape Rooms: Zombie Roadhouse,https://worldofescapes.com/orlando/quests/breakout-escape-rooms-orlando-zombie-roadhouse
Florida,Orlando,Breakout Escape Rooms: Ringmaster's Den,https://worldofescapes.com/orlando/quests/breakout-escape-rooms-orlando-the-ringmasters-den
Florida,Orlando,The Escape Effect: At Odds With The Gods,https://worldofescapes.com/orlando/quests/the-escape-effect-at-odds-with-the-gods
Florida,Orlando,Escape Goat: Camp Echo,https://worldofescapes.com/orlando/quests/escape-goat-camp-echo
Florida,Orlando,The Great Escape Room: Dr. Watson’s Infirmary,https://worldofescapes.com/orlando/quests/The-Great-Escape-Room-The-Infirmary
Florida,Orlando,Lockbusters Escape Game: Pirate Adventure,https://worldofescapes.com/orlando/quests/lockbusters-escape-game-pirate-adventure
Florida,Orlando,Lockbusters Escape Game: The Collector,https://worldofescapes.com/orlando/quests/lockbusters-escape-game-the-collector
Florida,Orlando,Escape Goat: Area 51,https://worldofescapes.com/orlando/quests/escape-goat-area-51
Florida,Orlando,The Escape Effect: Sherlock Studies,https://worldofescapes.com/orlando/quests/the-escape-effect-sherlock-studies
Florida,Orlando,The Escape Company: Legend of The Silent Tide,https://worldofescapes.com/orlando/quests/escape-room-entertainment-legend-of-the-silent-tide
Florida,Orlando,"""America's Escape Game"": Asylum",https://worldofescapes.com/orlando/quests/americas-escape-game-orlando-asylum
Florida,Orlando,The Escape Company: Suburban Serial Killer,https://worldofescapes.com/orlando/quests/escape-room-entertainment-suburban-serial-killer
Florida,Orlando,Anonymous Games: Down the Rabbit Hole,https://worldofescapes.com/orlando/quests/anonymous-games-down-the-rabbit-hole
Florida,Orlando,The Escape Company: The Knights of Norwich,https://worldofescapes.com/orlando/quests/escape-room-entertainment-pandorum
Florida,Orlando,The Escape Company: Outlawed,https://worldofescapes.com/orlando/quests/escape-room-entertainment-outlawed
Florida,Orlando,Locksmith Escape Games: Rescue from Voodoo Island,https://worldofescapes.com/orlando/quests/locksmith-escape-games-rescue-from-voodoo-island
Florida,Orlando,Locksmith Escape Games: The Curse of the Evil Genie,https://worldofescapes.com/orlando/quests/locksmith-escape-games-the-curse-of-evil-genie
Florida,Orlando,Digital Escape Rooms: The Sol Solution,https://worldofescapes.com/orlando/quests/digital-escape-rooms-the-sol-solution
Florida,Orlando,The Great Escape Room: The President's Bunker,https://worldofescapes.com/orlando/quests/the-great-escape-room-the-presidents-bunker
Florida,Orlando,Escape Artists: Rest Easy Motel,https://worldofescapes.com/orlando/quests/escape-artists-orlando-rest-easy-motel
Florida,Orlando,Dare 2 Escape: The Dig,https://worldofescapes.com/orlando/quests/dare-2-escape-the-dig
Florida,Orlando,"""Doldrick's Escape Room"": Captain Spoopy Bones and the Magnificent Quest for some Other Pirate's Treasure",https://worldofescapes.com/orlando/quests/doldricks-escape-room-captain-spoopy-bones-and-the-magnificent-quest-for-some-other-pirates-treasure
Florida,Orlando,Escape Artists: Secret Society,https://worldofescapes.com/orlando/quests/escape-artists-orlando-secret-society
Florida,Orlando,VR Territory: Escape The Lost Pyramid VR,https://worldofescapes.com/orlando/quests/vr-territory-escape-the-lost-pyramid
Florida,Orlando,The Great Escape Room: Escape Artist,https://worldofescapes.com/orlando/quests/The-Great-Escape-Room-The-Gameroom
Florida,Orlando,Dare 2 Escape: Paper Company,https://worldofescapes.com/orlando/quests/dare-2-escape-paper-company
Florida,Orlando,Escapology: 7 Deadly Sins,https://worldofescapes.com/orlando/quests/escapology-orlando-7-deadly-sins
Florida,Orlando,Breakout Escape Rooms: Game of Espionage,https://worldofescapes.com/orlando/quests/breakout-escape-rooms-orlando-game-of-espionage
Florida,Orlando,Escapology: Under Pressure,https://worldofescapes.com/orlando/quests/escapology-orlando-under-pressure
Florida,Orlando,Lockbusters Escape Game: Chopper Down,https://worldofescapes.com/orlando/quests/lockbusters-escape-game-chopper-down
Florida,Orlando,Escapology: Narco,https://worldofescapes.com/orlando/quests/escapology-orlando-narco
Florida,Orlando,Escape Artists: Protocol Zero,https://worldofescapes.com/orlando/quests/escape-artists-protocol-zero
Florida,Orlando,Dare 2 Escape: The Ringmaster,https://worldofescapes.com/orlando/quests/dare-2-escape-the-ringmaster
Florida,Orlando,Escapology: Mansion Murder,https://worldofescapes.com/orlando/quests/escapology-orlando-mansion-murder
Florida,Orlando,A Narrow Escape: Doctor Lycan,https://worldofescapes.com/orlando/quests/a-narrow-escape-doctor-lycan
Florida,Orlando,Digital Escape Rooms: The Highland Multiverse VR,https://worldofescapes.com/orlando/quests/digital-escape-rooms-the-highland-multiverse
Florida,Orlando,Dare 2 Escape: The Asylum,https://worldofescapes.com/orlando/quests/dare-2-escape-the-asylum
Florida,Orlando,A Narrow Escape: Toxicity,https://worldofescapes.com/orlando/quests/a-narrow-escape-toxicity
Florida,Orlando,VR Territory: Beyond Medusa’s Gate VR,https://worldofescapes.com/orlando/quests/vr-territory-beyond-medusas-gate
Florida,Orlando,Escape Goat: A Fisherman's Tale,https://worldofescapes.com/orlando/quests/escape-goat-a-fishermans-tale
Florida,Orlando,Lockbusters Escape Game: Bank Heist,https://worldofescapes.com/orlando/quests/lockbusters-escape-game-bank-heist
Florida,Orlando,Lockbusters Escape Game: Cremlocke Manor,https://worldofescapes.com/orlando/quests/lockbusters-escape-game-cremlocke-manor
Florida,Orlando,Dare 2 Escape: The Archive,https://worldofescapes.com/orlando/quests/dare-2-escape-the-archive
Florida,Orlando,Locksmith Escape Games: What Happened in Raven Woods?,https://worldofescapes.com/orlando/quests/locksmith-escape-games-what-happened-in-raven-woods
Florida,Orlando,Digital Escape Rooms: Lockdown,https://worldofescapes.com/orlando/quests/digital-escape-rooms-lockdown
Florida,Orlando,The Void: STAR WARS™: Secrets of the Empire VR,https://worldofescapes.com/orlando/quests/the-void-orlando-star-wars-secrets-of-the-empire
Florida,Orlando,The Escape Effect: A Knight To Escape,https://worldofescapes.com/orlando/quests/the-escape-effect-a-knight-to-escape
Florida,Orlando,Escape Artists: Cat Burglar,https://worldofescapes.com/orlando/quests/escape-artists-orlando-cat-burglar
Florida,Orlando,The Escape Effect: Encore,https://worldofescapes.com/orlando/quests/the-escape-effect-encore
Florida,Orlando,The Escape Company: Pandorum,https://worldofescapes.com/orlando/quests/escape-room-entertainment-the-hidden-temple
Florida,Orlando,The Great Escape Lakeside: The Clue,https://worldofescapes.com/orlando/quests/great-escape-lakeside-clue-escape-room
Florida,Orlando,Breakout Escape Rooms: Motive for Malice,https://worldofescapes.com/orlando/quests/breakout-escape-rooms-orlando-motive-for-malice
Florida,Orlando,Dare 2 Escape: The Video Store,https://worldofescapes.com/orlando/quests/dare-2-escape-the-video-store
Florida,Orlando,The Void: Ralph Breaks VR,https://worldofescapes.com/orlando/quests/the-void-orlando-ralph-breaks-vr
Florida,Orlando,"""America's Escape Game"": Revenge of the Tomb",https://worldofescapes.com/orlando/quests/America-s-Escape-Game-The-Lost-Tomb-of-Monthu
Florida,Orlando,A Narrow Escape: The Woods,https://worldofescapes.com/orlando/quests/a-narrow-escape-the-woods
Florida,Orlando,MindQuest Escape Games: Mad Scientist,https://worldofescapes.com/orlando/quests/Mindquest-Live-MAD-SCIENTIST
Florida,Orlando,MindQuest Escape Games: Diamond Heist,https://worldofescapes.com/orlando/quests/Mindquest-Live-Diamond-Heist
Florida,Orlando,MindQuest Escape Games: Cyber Crash,https://worldofescapes.com/orlando/quests/Cyber-Crash
Florida,Orlando,"""America's Escape Game"": Face Off",https://worldofescapes.com/orlando/quests/Americas-Escape-Game-Face-OFF
Florida,Orlando,MindQuest Escape Games: The Bomb,https://worldofescapes.com/orlando/quests/Mindquest-Live-The-Bomb
Florida,Orlando,The Great Escape Room: Sherlock Holmes’ Library,https://worldofescapes.com/orlando/quests/The-Great-Escape-Room-The-Library
Florida,Orlando,American Escape Rooms: Mad Professor's Asylum,https://worldofescapes.com/orlando/quests/american-escape-rooms-orlando-mad-professors-asylum
Florida,Orlando,MindQuest Escape Games: The Haunting,https://worldofescapes.com/orlando/quests/mindquest-escape-games-the-haunting
Florida,Orlando,American Escape Rooms: Cold War Crisis,https://worldofescapes.com/orlando/quests/american-escape-rooms-orlando-cold-war-crisis
Florida,Orlando,Escape Goat: 221B The Study,https://worldofescapes.com/orlando/quests/escape-goat-221b-the-study
Florida,Orlando,MindQuest Escape Games: Contagion,https://worldofescapes.com/orlando/quests/mindquest-live-contagion
Florida,Orlando,MindQuest Escape Games: The Asylum: Ward 5,https://worldofescapes.com/orlando/quests/mindquest-live-the-asylum-ward-5
Florida,Orlando,American Escape Rooms: Zombie Apocalypse,https://worldofescapes.com/orlando/quests/american-escape-rooms-orlando-zombie-apocalypse
Florida,Orlando,American Escape Rooms: Mind-Boggling,https://worldofescapes.com/orlando/quests/american-escape-rooms-orlando-mind-boggling
Florida,Panama City,Escape Manor: The Asylum,https://worldofescapes.com/panama-city/quests/Escape-Manor-The-Asylum
Florida,Panama City,Escape Manor: The Attic,https://worldofescapes.com/panama-city/quests/Escape-Manor-The-Attic
Florida,Panama City,Escape Zone 60: Navy Seals,https://worldofescapes.com/panama-city/quests/escape-zone-60-navy-seals
Florida,Panama City,Escape Zone 60: Death Row,https://worldofescapes.com/panama-city/quests/escape-zone-60-death-row
Florida,Panama City,Escape Zone 60:  Castle Escape,https://worldofescapes.com/panama-city/quests/escape-zone-60-castle-escape
Florida,Panama City,Royal Escape Rooms\t: Area Z51 - Zombie Escape,https://worldofescapes.com/panama-city/quests/royal-escape-rooms-xcape-zone-51-zombies-outbreak
Florida,Panama City,Royal Escape Rooms\t: The Forbidden Tomb,https://worldofescapes.com/panama-city/quests/royal-escape-rooms-the-forbidden-tomb
Florida,Panama City,Royal Escape Rooms\t: The Mermaid's Escape,https://worldofescapes.com/panama-city/quests/royal-escape-rooms-pirate-escape
Florida,Panama City,Royal Escape Rooms\t: Spaceship Escape,https://worldofescapes.com/panama-city/quests/royal-escape-rooms-spaceship-escape
Florida,Panama City,Escape Manor: The Study,https://worldofescapes.com/panama-city/quests/escape-manor-the-study
Florida,Pensacola,Escape on Palafox: Haunted,https://worldofescapes.com/pensacola/quests/escape-on-palafox-haunted
Florida,Pensacola,Escape on Palafox: The Museum Robbery,https://worldofescapes.com/pensacola/quests/escape-on-palafox-the-museum-robbery
Florida,Pensacola,Escape LOL: Prison Escape,https://worldofescapes.com/pensacola/quests/escape-lol-prison-escape
Florida,Pensacola,Escape Zone 60: The Asylum,https://worldofescapes.com/pensacola/quests/escape-zone-60-the-asylum
Florida,Pensacola,Escape Zone 60: The Bank,https://worldofescapes.com/pensacola/quests/escape-zone-60-the-bank
Florida,Pensacola,Exithis: Locked Up,https://worldofescapes.com/pensacola/quests/exithis-locked-up
Florida,Pensacola,Exithis: Temple Ruins,https://worldofescapes.com/pensacola/quests/exithis-pensacola-temple-ruins
Florida,Pensacola,Escape on Palafox: It’s all WIRED!,https://worldofescapes.com/pensacola/quests/escape-on-palafox-its-all-wired
Florida,Pensacola,Exithis: Oval Office,https://worldofescapes.com/pensacola/quests/exithis-oval-office
Florida,Pensacola,Cryptic Rooms: Escape the Maniac,https://worldofescapes.com/pensacola/quests/cryptic-rooms-escape-the-maniac
Florida,Pensacola,Cryptic Rooms: Magical Musical Mystery,https://worldofescapes.com/pensacola/quests/cryptic-rooms-magical-musical-mystery
Florida,Pensacola,Escape LOL: Pirate Peril,https://worldofescapes.com/pensacola/quests/escape-lol-pirate-peril
Florida,Port St. Lucie,Escape Room PSL: Simon's Room II,https://worldofescapes.com/port-st-lucie/quests/escape-room-psl-simons-room-2
Florida,Port St. Lucie,Escape Room Vero Beach: The Apartment,https://worldofescapes.com/port-st-lucie/quests/escape-room-vero-beach-the-apartment
Florida,Port St. Lucie,Escape Room PSL: Vortex,https://worldofescapes.com/port-st-lucie/quests/escape-room-psl-vortex
Florida,Port St. Lucie,Escape Room Vero Beach: Virogenix Lab,https://worldofescapes.com/port-st-lucie/quests/escape-room-vero-beach-virogenix-lab
Florida,Sarasota,Escape Bradenton: Inheritance,https://worldofescapes.com/sarasota/quests/escape-bradenton-inheritance
Florida,Sarasota,Escape Countdown: Mad Hatter,https://worldofescapes.com/sarasota/quests/Escape-Countdown-Sarasota-Mad-Hatter
Florida,Sarasota,Escape Reality Games: Mafia Mayhem,https://worldofescapes.com/sarasota/quests/escape-reality-games-mafia-mayhem
Florida,Sarasota,Escape Reality Games: Descent Into Madness,https://worldofescapes.com/sarasota/quests/escape-reality-games-descent-into-madness
Florida,Sarasota,Escape Bradenton: Blitzkrieg,https://worldofescapes.com/sarasota/quests/escape-bradenton-blitzkrieg
Florida,Sarasota,"""Lokey's Escape Rooms"": Trouble in Tinseltown",https://worldofescapes.com/sarasota/quests/lokeys-escape-rooms-trouble-in-tinseltown
Florida,Sarasota,Escape Rooms Unlocked: Inventor's Basement,https://worldofescapes.com/sarasota/quests/escape-rooms-unlocked-inventors-basement
Florida,Sarasota,Escape Rooms Unlocked: The Hideout,https://worldofescapes.com/sarasota/quests/escape-rooms-unlocked-the-hideout
Florida,Sarasota,Premier Escape Adventures: Date Night Disaster,https://worldofescapes.com/sarasota/quests/premier-date-night-disaster
Florida,Sarasota,Premier Escape Adventures: Houdini's Book of Secrets,https://worldofescapes.com/sarasota/quests/premier-houdinis-book-of-secrets
Florida,Sarasota,Escape Countdown: Trouble in Paradise,https://worldofescapes.com/sarasota/quests/escape-countdown-sarasota-trouble-in-paradise
Florida,Sarasota,Escape Bradenton: Mutiny,https://worldofescapes.com/sarasota/quests/escape-bradenton-mutiny
Florida,Sarasota,GR8 Escape Challenge: Jig,https://worldofescapes.com/sarasota/quests/escape-room-sarasota-cabin-in-the-woods
Florida,Sarasota,"""Lokey's Escape Rooms"": Detention",https://worldofescapes.com/sarasota/quests/lokeys-escape-rooms-detention
Florida,Sarasota,Escape Bradenton: Casa Segura,https://worldofescapes.com/sarasota/quests/escape-bradenton-casa-segura
Florida,Sarasota,Escape Countdown: Bloody Mary,https://worldofescapes.com/sarasota/quests/escape-countdown-sarasota-bloody-mary
Florida,Sarasota,Escape Countdown: Hyde Away,https://worldofescapes.com/sarasota/quests/escape-countdown-sarasota-hyde-away
Florida,Sarasota,"""Lokey's Escape Rooms"": Press Start",https://worldofescapes.com/sarasota/quests/lokeys-escape-rooms-press-start
Florida,Sarasota,Escape Countdown: Game On!,https://worldofescapes.com/sarasota/quests/escape-countdown-sarasota-game-on
Florida,Sarasota,GR8 Escape Challenge: King's Gambit,https://worldofescapes.com/sarasota/quests/gr8-escape-challenge-kings-gambit
Florida,Sarasota,GR8 Escape Challenge: Area 51,https://worldofescapes.com/sarasota/quests/escape-room-sarasota-the-green-isle
Florida,Sarasota,Premier Escape Adventures: Crisis at the North Pole,https://worldofescapes.com/sarasota/quests/premier-escape-adventures-crisis-at-the-north-pole
Florida,Sarasota,Escape Reality Games: Clue-Dunnit?,https://worldofescapes.com/sarasota/quests/escape-reality-games-clue-dunnit
Florida,Sarasota,Escape Reality Games: Robot Toy Factory,https://worldofescapes.com/sarasota/quests/escape-reality-games-robot-toy-factory
Florida,Sarasota,Escape Bradenton: Conspiracy,https://worldofescapes.com/sarasota/quests/escape-bradenton-conspiracy
Florida,Sarasota,Element of Escape: Hotel California,https://worldofescapes.com/sarasota/quests/element-of-escape-hotel-california
Florida,Sarasota,Escape Bradenton: Crucifixus,https://worldofescapes.com/sarasota/quests/escape-bradenton-crucifixus
Florida,Sarasota,Escape Countdown: Jail Break,https://worldofescapes.com/sarasota/quests/escape-countdown-sarasota-prison-break
Florida,Sarasota,Escape Countdown: An Evening In Paris,https://worldofescapes.com/sarasota/quests/escape-countdown-sarasota-an-evening-in-paris
Florida,Sarasota,Element of Escape: The Heist,https://worldofescapes.com/sarasota/quests/element-of-escape-the-heist
Florida,Sarasota,GR8 Escape Challenge: The Detective,https://worldofescapes.com/sarasota/quests/escape-room-sarasota-the-detective
Florida,Sarasota,Escape Reality Games: Corporate Spy,https://worldofescapes.com/sarasota/quests/escape-reality-games-corporate-spy
Florida,Sarasota,Element of Escape: Shipwrecked,https://worldofescapes.com/sarasota/quests/element-of-escape-shipwrecked
Florida,Sarasota,Element of Escape: Santa’s Workshop,https://worldofescapes.com/sarasota/quests/element-of-escape-santas-workshop
Florida,Sarasota,Escape Reality Games: Elf Academy,https://worldofescapes.com/sarasota/quests/escape-reality-games-elf-academy
Florida,St. Augustine,Xscape Our Rooms: Blackbeard's Brig,https://worldofescapes.com/st-augustine/quests/xscape-our-rooms-blackbeards-brig
Florida,St. Augustine,Escape U: Save the Fleet,https://worldofescapes.com/st-augustine/quests/escape-u-save-the-fleet
Florida,St. Augustine,Escape U: Castillo De Matanzas,https://worldofescapes.com/st-augustine/quests/escape-u-castillo-de-matanzas
Florida,St. Augustine,Xscape Our Rooms: The Lucky Duck Speakeasy,https://worldofescapes.com/st-augustine/quests/xscape-our-rooms-the-lucky-duck-speakeasy
Florida,St. Augustine,Escape U: The Asylum,https://worldofescapes.com/st-augustine/quests/escape-u-the-asylum
Florida,St. Augustine,Xscape Our Rooms: The Chamber,https://worldofescapes.com/st-augustine/quests/xscape-our-rooms-the-chamber
Florida,Tallahassee,Breakout Games: The Kidnapping,https://worldofescapes.com/tallahassee/quests/breakout-games-tallahassee-the-kidnapping
Florida,Tallahassee,Breakout Games: Hostage,https://worldofescapes.com/tallahassee/quests/breakout-games-tallahassee-hostage
Florida,Tallahassee,Breakout Games: Mystery Mansion,https://worldofescapes.com/tallahassee/quests/breakout-games-tallahassee-mystery-mansion
Florida,Tallahassee,Breakout Games: Operation: Casino,https://worldofescapes.com/tallahassee/quests/breakout-games-tallahassee-operation-casino
Florida,Tallahassee,The Mansion Escape Room: Pirate Plank Escape,https://worldofescapes.com/tallahassee/quests/the-mansion-escape-room-pirate-plank-escape
Florida,Tallahassee,The Mansion Escape Room: Espionage Agent,https://worldofescapes.com/tallahassee/quests/the-mansion-escape-room-espionage-agent
Florida,Tallahassee,The Mansion Escape Room: Chef Olivieri Rescue,https://worldofescapes.com/tallahassee/quests/the-mansion-escape-room-chef-olivieri-rescue
Florida,Tallahassee,EXIT Tallahassee: Saloon,https://worldofescapes.com/tallahassee/quests/exit-tallahassee-saloon
Florida,Tallahassee,Minervium: The Crash,https://worldofescapes.com/tallahassee/quests/escape-key-tallahassee-the-crash
Florida,Tallahassee,EXIT Tallahassee: Jail Break,https://worldofescapes.com/tallahassee/quests/exit-tallahassee-jail-break
Florida,Tallahassee,EXIT Tallahassee: Room 407,https://worldofescapes.com/tallahassee/quests/exit-tallahassee-room-407
Florida,Tampa,"""Breakout's Imagine Escape Rooms"": Jungle Gem",https://worldofescapes.com/tampa/quests/imagine-escape-games-jungle-gem
Florida,Tampa,"""Breakout's Imagine Escape Rooms"": The Alleyway Vigilantes",https://worldofescapes.com/tampa/quests/imagine-escape-games-the-alleyway
Florida,Tampa,Outerlife Studios: Scorched,https://worldofescapes.com/tampa/quests/outerlife-studios-scorched
Florida,Tampa,"""Breakout's Imagine Escape Rooms"": DreamWeaver",https://worldofescapes.com/tampa/quests/imagine-escape-games-dreamweaver
Florida,Tampa,"""Breakout's Imagine Escape Rooms"": reSEArch",https://worldofescapes.com/tampa/quests/imagine-escape-games-research
Florida,Tampa,Outerlife Studios: Hero League,https://worldofescapes.com/tampa/quests/outerlife-studios-hero-league
Florida,Tampa,Outerlife Studios: Disarm,https://worldofescapes.com/tampa/quests/outerlife-studios-disarm
Florida,Tampa,"""Breakout's Imagine Escape Rooms"": The Kidnapping",https://worldofescapes.com/tampa/quests/breakouts-imagine-escape-rooms-the-kidnapping
Florida,Tampa,Can You Escape?: Escape From Jose Gaspar's Pirate Ship,https://worldofescapes.com/tampa/quests/can-you-escape-escape-from-jose-gaspars-pirate-ship
Florida,Tampa,Escape FLA: The Lost Temple,https://worldofescapes.com/tampa/quests/escape-fla-the-lost-temple
Florida,Tampa,Escape Thrill: Sixth Wave,https://worldofescapes.com/tampa/quests/escape-thrill-sixth-wave
Florida,Tampa,"""America's Escape Game"": Crisis at 1600",https://worldofescapes.com/tampa/quests/americas-escape-game-tampa-crisis-at-1600
Florida,Tampa,"""America's Escape Game"": Pandemic",https://worldofescapes.com/tampa/quests/americas-escape-game-tampa-pandemic
Florida,Tampa,"""America's Escape Game"": Asylum",https://worldofescapes.com/tampa/quests/americas-escape-game-tampa-asylum
Florida,Tampa,Can You Escape?: Escape from London,https://worldofescapes.com/tampa/quests/can-you-escape-escape-from-london
Florida,Tampa,Rock Ave Escape Room: Apartment A.I.,https://worldofescapes.com/tampa/quests/rock-ave-escape-room-apartment-ai
Florida,Tampa,The Great Escape Room: Dr. Watson’s Infirmary,https://worldofescapes.com/tampa/quests/the-great-escape-room-tampa-infirmary
Florida,Tampa,Can You Escape?: The Medieval Adventure,https://worldofescapes.com/tampa/quests/can-you-escape-the-medieval-adventure
Florida,Tampa,Escape Room Extreme: Dracula’s Castle,https://worldofescapes.com/tampa/quests/escape-room-extreme-draculas-castle
Florida,Tampa,Rabbit Hole Escape Games: Shadows of the Skunk Ape,https://worldofescapes.com/tampa/quests/rabbit-hole-escape-games-shadows-of-the-skunk-ape
Florida,Tampa,"""Bet You Can't Escape"": Escape Arcadia",https://worldofescapes.com/tampa/quests/bet-you-cant-escape-escape-arcadia
Florida,Tampa,Escape Thrill: Skinned Alive,https://worldofescapes.com/tampa/quests/escape-thrill-skinned-alive
Florida,Tampa,The Great Escape Room: Professor Moriarty’s Gameroom,https://worldofescapes.com/tampa/quests/the-great-escape-room-the-gameroom
Florida,Tampa,Beach Escape Game: Lost Treasure,https://worldofescapes.com/tampa/quests/Beach-Escape-Game-Lost-Treasure
Florida,Tampa,Tampa Bay Escape Room: Kidnapped,https://worldofescapes.com/tampa/quests/Tampa-Bay-Escape-Room-Kidnapped
Florida,Tampa,Fantasy Escapes: GameEscape,https://worldofescapes.com/tampa/quests/fantasy-escapes-gamescape
Florida,Tampa,Make a Break Escape: Black Site,https://worldofescapes.com/tampa/quests/make-a-break-escape-black-site
Florida,Tampa,Escape FLA: The Hatch,https://worldofescapes.com/tampa/quests/escape-fla-the-hatch
Florida,Tampa,Escape Room Extreme: Da Vinci’s Office,https://worldofescapes.com/tampa/quests/escape-room-extreme-da-vincis-office
Florida,Tampa,Escape FLA: Vegas Hangover,https://worldofescapes.com/tampa/quests/escape-fla-vegas-hangover
Florida,Tampa,"""Bet You Can't Escape"": Dream Extraction",https://worldofescapes.com/tampa/quests/bet-you-cant-escape-dream-extraction
