state,city,company_and_room,woe_room_url
California,Los Angeles,Xscape Pods: Midnight on the Bayou,https://worldofescapes.com/los-angeles/quests/red-lantern-escape-rooms-midnight-on-the-bayou
California,Los Angeles,60out Escape Rooms: Forgotten Pharaoh Escape,https://worldofescapes.com/los-angeles/quests/xscape-pods-forgotten-pharaoh-escape
California,Los Angeles,Mission Escape Games: Tiki Time!,https://worldofescapes.com/los-angeles/quests/60out-escape-rooms-tiki-time
California,Los Angeles,Escape Hotel: Mission's Breakout: the Ultimate Bank Heist,https://worldofescapes.com/los-angeles/quests/mission-escape-games-anaheim-missions-breakout-the-ultimate-bank-heist
California,Los Angeles,Legacy Escape Rooms: Slaughter,https://worldofescapes.com/los-angeles/quests/escape-hotel-slaughter
California,Los Angeles,Cross Roads Escape Games: Cabin 13,https://worldofescapes.com/los-angeles/quests/legacy-escape-rooms-cabin-13
California,Los Angeles,Chronos Escape Room: The Psych Ward,https://worldofescapes.com/los-angeles/quests/cross-roads-escape-games-the-psych-ward
California,Los Angeles,Level Games: Chronostopia,https://worldofescapes.com/los-angeles/quests/chronos-escape-room-chronostopia
California,Los Angeles,60out Escape Rooms: The Fortune Teller,https://worldofescapes.com/los-angeles/quests/escapades-la-the-fortune-teller
California,Los Angeles,Exodus Escape Room: Red Alert,https://worldofescapes.com/los-angeles/quests/60out-escape-rooms-red-alert
California,Los Angeles,UNLOCKED: Escape Room : Nuclear Option,https://worldofescapes.com/los-angeles/quests/esc-escape-rooms-nuclear-option
California,Los Angeles,Chronos Escape Room: Pharaoh's Curse,https://worldofescapes.com/los-angeles/quests/exodus-escape-room-pharaohs-curse
California,Los Angeles,Fox in a Box: The Return of the Magician,https://worldofescapes.com/los-angeles/quests/unlocked-escape-room-the-return-of-the-magician
California,Los Angeles,Hatch Escapes: The Last Winter,https://worldofescapes.com/los-angeles/quests/chronos-escape-room-the-last-winter
California,Los Angeles,Maze Rooms: The Other Side,https://worldofescapes.com/los-angeles/quests/room-escape-los-angeles-the-other-side
California,Los Angeles,The Basement: Mission Sigma VR,https://worldofescapes.com/los-angeles/quests/parallel-universe-vr-mission-sigma
California,Los Angeles,60out Escape Rooms: Lab Rat,https://worldofescapes.com/los-angeles/quests/hatch-escapes-lab-rat
California,Los Angeles,Black Market Escape Rooms: Vampire,https://worldofescapes.com/los-angeles/quests/maze-rooms-vampire
California,Los Angeles,Unlocked Escape Rooms: Chapter 4: The Courtyard,https://worldofescapes.com/los-angeles/quests/the-basement-la-the-courtyard
California,Los Angeles,Escape Hotel: Hyde Circus,https://worldofescapes.com/los-angeles/quests/60out-escape-rooms-hyde-and-seek
California,Los Angeles,Exodus Escape Room: MURDER CO.,https://worldofescapes.com/los-angeles/quests/black-market-escape-rooms-murder-co
California,Los Angeles,The Prism Escape Rooms: The Professor's Basement,https://worldofescapes.com/los-angeles/quests/unlocked-escape-rooms-the-professors-basement
California,Los Angeles,Mission Escape Games: Agent,https://worldofescapes.com/los-angeles/quests/escape-hotel-agent
California,Los Angeles,PuzzleMazement: SUBmerged,https://worldofescapes.com/los-angeles/quests/exodus-escape-room-ah-submerged
California,Los Angeles,Back in Time Escape Rooms: Ground Zero,https://worldofescapes.com/los-angeles/quests/the-prism-escape-rooms-ground-zero
California,Los Angeles,Get the F Out: Operation: End of Days,https://worldofescapes.com/los-angeles/quests/mission-escape-games-anaheim-operation-end-of-days
California,Los Angeles,Maze Rooms: Mailroom Madness,https://worldofescapes.com/los-angeles/quests/puzzlemazement-mailroom-madness
California,Los Angeles,Escape Hotel: Inside Area 51,https://worldofescapes.com/los-angeles/quests/back-in-time-escape-rooms-inside-area-51
California,Los Angeles,Excido Escape Room: The Experiment,https://worldofescapes.com/los-angeles/quests/get-the-f-out-the-experiment
California,Los Angeles,Back in Time Escape Rooms: Jack the Ripper,https://worldofescapes.com/los-angeles/quests/maze-rooms-jack-the-ripper
California,Los Angeles,Maze Rooms: Attic,https://worldofescapes.com/los-angeles/quests/escape-hotel-attic
California,Los Angeles,Exodus Escape Room: The Cabin,https://worldofescapes.com/los-angeles/quests/excido-escape-room-the-cabin
California,Los Angeles,Arcane Escape Rooms: The Salem Witch Hunt,https://worldofescapes.com/los-angeles/quests/back-in-time-escape-rooms-the-salem-witch-hunt
California,Los Angeles,Quest Room: Sky Odyssey,https://worldofescapes.com/los-angeles/quests/maze-rooms-sky-odyssey
California,Los Angeles,PuzzleMazement: The Elevator,https://worldofescapes.com/los-angeles/quests/exodus-escape-room-ah-the-elevator
California,Los Angeles,All Locked Up: The Agency,https://worldofescapes.com/los-angeles/quests/arcane-escape-rooms-the-agency
California,Los Angeles,Escape Hotel: Amnesia,https://worldofescapes.com/los-angeles/quests/quest-room-amnesia
California,Los Angeles,All Locked Up: Doll House V.2,https://worldofescapes.com/los-angeles/quests/puzzlemazement-doll-house
California,Los Angeles,The Hidden Passage: Aunt Debbie's Apartment,https://worldofescapes.com/los-angeles/quests/all-locked-up-aunt-debbies-apartment
California,Los Angeles,Back in Time Escape Rooms: Circus,https://worldofescapes.com/los-angeles/quests/escape-hotel-circus
California,Los Angeles,PuzzleMazement: The Classroom,https://worldofescapes.com/los-angeles/quests/all-locked-up-the-classroom
California,Los Angeles,EscapeIQ: The Pharaoh's Curse,https://worldofescapes.com/los-angeles/quests/the-hidden-passage-the-pharaohs-curse
California,Los Angeles,Maze Rooms: Wanted: Dead or Alive?,https://worldofescapes.com/los-angeles/quests/back-in-time-escape-rooms-wanted-dead-or-alive
California,Los Angeles,Level Games: Evans & Sontag Jail Cell Escape,https://worldofescapes.com/los-angeles/quests/puzzlemazement-jail-cell-escape
California,Los Angeles,Fox in a Box: Dr. Brown's Manor,https://worldofescapes.com/los-angeles/quests/escapeiq-dr-browns-manor
California,Los Angeles,Quest Room: Lord of the Swords,https://worldofescapes.com/los-angeles/quests/maze-rooms-lord-of-the-swords
California,Los Angeles,EscapeX Rooms: Doggy Dog World,https://worldofescapes.com/los-angeles/quests/escapades-la-doggy-dog-world
California,Los Angeles,Two Bit Circus: Dracula: The Final Hour,https://worldofescapes.com/los-angeles/quests/room-escape-los-angeles-dracula
California,Los Angeles,Two Bit Circus: Perfumer,https://worldofescapes.com/los-angeles/quests/quest-room-perfumer
California,Los Angeles,Two Bit Circus: The Curse of the Black Knight,https://worldofescapes.com/los-angeles/quests/escapex-rooms-the-curse-of-the-black-night
California,Los Angeles,Two Bit Circus: Space Squad in Space,https://worldofescapes.com/los-angeles/quests/two-bit-circus-space-squad-in-space
California,Los Angeles,All Locked Up: Escape from the Werewolf Village,https://worldofescapes.com/los-angeles/quests/two-bit-circus-escape-from-the-werewolf-village
California,Los Angeles,Virtual Room Los Angeles: Dr. Botcher's Minute Medical School,https://worldofescapes.com/los-angeles/quests/two-bit-circus-dr-botchers-minute-medical-school
California,Los Angeles,Escape the Room: The Raft VR,https://worldofescapes.com/los-angeles/quests/two-bit-circus-story-room
California,Los Angeles,60out Escape Rooms: The Morgue,https://worldofescapes.com/los-angeles/quests/all-locked-up-the-morgue
California,Los Angeles,Escape the Room: Are We Dead? VR,https://worldofescapes.com/los-angeles/quests/virtual-room-los-angeles-are-we-dead
California,Los Angeles,Quest Room: Western Bank Heist,https://worldofescapes.com/los-angeles/quests/escape-the-room-la-western-bank-heist
California,Los Angeles,The Bunker Experience: HERO escape room,https://worldofescapes.com/los-angeles/quests/60out-escape-rooms-hero-escape-room
California,Los Angeles,PanIQ Escape Room: Cartman's Escape Room,https://worldofescapes.com/los-angeles/quests/escape-the-room-la-cartmans-escape-room
California,Los Angeles,Exit Game: Resurrection,https://worldofescapes.com/los-angeles/quests/quest-room-resurrection
California,Los Angeles,Enchanted Escape Room: Chapter 3: The Gatekeeper,https://worldofescapes.com/los-angeles/quests/the-bunker-experience-the-gatekeeper
California,Los Angeles,Breach Escape Room: Insane Asylum,https://worldofescapes.com/los-angeles/quests/paniq-entertainment-insane-asylum
California,Los Angeles,The Room LA: The Lab 51,https://worldofescapes.com/los-angeles/quests/exit-game-mission2-the-lab
California,Los Angeles,Escape the Room: The Tavern - Chapter 2,https://worldofescapes.com/los-angeles/quests/enchanted-escape-room-the-tavern-chapter-2
California,Los Angeles,The Basement: Firewall,https://worldofescapes.com/los-angeles/quests/breach-escape-room-firewall
California,Los Angeles,Square Room Escape: The Manor,https://worldofescapes.com/los-angeles/quests/the-room-la-the-manor
California,Los Angeles,Brainy Actz: Jurassic Escape,https://worldofescapes.com/los-angeles/quests/escape-the-room-la-jurassic-escape
California,Los Angeles,Escape the Room: Humana Festum,https://worldofescapes.com/los-angeles/quests/the-basement-humana-festum
California,Los Angeles,Enchanted Escape Room: Undercooked,https://worldofescapes.com/los-angeles/quests/square-room-escape-undercooked
California,Los Angeles,Escape Room LA: Wanted in the West,https://worldofescapes.com/los-angeles/quests/brainy-actz-wanted-in-the-west
California,Los Angeles,Maze Rooms: The Clock Tower,https://worldofescapes.com/los-angeles/quests/escape-the-room-la-the-clock-tower
California,Los Angeles,The Basement: Guardian of the Scroll - Chapter 1,https://worldofescapes.com/los-angeles/quests/enchanted-escape-room-guardian-of-the-scroll-chapter-1
California,Los Angeles,Maze Rooms: Edison Puzzle Labs,https://worldofescapes.com/los-angeles/quests/edison-puzzle-labs
California,Los Angeles,Chronos Escape Room: Atlantis,https://worldofescapes.com/los-angeles/quests/escape-room-la-atlantis
California,Los Angeles,Escape Room LA: Motel,https://worldofescapes.com/los-angeles/quests/maze-rooms-motel
California,Los Angeles,Exodus Escape Room: Chapter 1: The Basement,https://worldofescapes.com/los-angeles/quests/the-basement-the-basement
California,Los Angeles,60out Escape Rooms: Prison,https://worldofescapes.com/los-angeles/quests/maze-rooms-prison
California,Los Angeles,Excido Escape Room: Awakened,https://worldofescapes.com/los-angeles/quests/chronos-escape-room-awakened
California,Los Angeles,Brainy Actz: The Detective,https://worldofescapes.com/los-angeles/quests/escape-room-la-the-detective
California,Los Angeles,Maze Rooms: Masquerade Manor,https://worldofescapes.com/los-angeles/quests/Exodus-Escape-Room-Masquerade-Manor-Anaheim-Hills
California,Los Angeles,Horror Escapes LA: Mafia,https://worldofescapes.com/los-angeles/quests/60out-hangover
California,Los Angeles,Square Room Escape: The Magic Archive,https://worldofescapes.com/los-angeles/quests/excido-escape-room-the-magic-archive
California,Los Angeles,60out Escape Rooms: The Smuggler,https://worldofescapes.com/los-angeles/quests/brainy-actz-the-smuggler
California,Los Angeles,Legend X Iteration: Maze Quiz,https://worldofescapes.com/los-angeles/quests/maze-rooms-maze-quiz
California,Los Angeles,Breach Escape Room: Zombie Lab,https://worldofescapes.com/los-angeles/quests/horror-escapes-la-zombie-lab
California,Los Angeles,Square Room Escape: Sorcerer's Study,https://worldofescapes.com/los-angeles/quests/Square-Room-Escape-harry-potter-room
California,Los Angeles,The Prism Escape Rooms: Amityville,https://worldofescapes.com/los-angeles/quests/60out-escape-rooms-amityville
California,Los Angeles,Maze Rooms: The Dynasty - Royal Library,https://worldofescapes.com/los-angeles/quests/legend-x-iteration-royal-library
California,Los Angeles,Escape Hotel: Secrets in Suburbia,https://worldofescapes.com/los-angeles/quests/the-scene-escape-rooms-secrets-in-suburbia
California,Los Angeles,Maze Rooms: Try-Wizard Tournament,https://worldofescapes.com/los-angeles/quests/square-room-escape-try-wizard-tournament
California,Los Angeles,Maze Rooms: Mystery Manor,https://worldofescapes.com/los-angeles/quests/the-prism-escape-rooms-mystery-manor
California,Los Angeles,MagIQ Room: Secret Mission,https://worldofescapes.com/los-angeles/quests/maze-rooms-spy-safe-house
California,Los Angeles,Back in Time Escape Rooms: Cursed Crypt,https://worldofescapes.com/los-angeles/quests/escape-hotel-cursed-crypt
California,Los Angeles,60out Escape Rooms: World of Illusions,https://worldofescapes.com/los-angeles/quests/maze-rooms-world-of-illusions
California,Los Angeles,The Room LA: The Abyss,https://worldofescapes.com/los-angeles/quests/maze-rooms-the-abyss
California,Los Angeles,60out Escape Rooms: The Pirate's Den,https://worldofescapes.com/los-angeles/quests/magiq-room-pirates-den
California,Los Angeles,The Basement: Operation: Santa's List,https://worldofescapes.com/los-angeles/quests/back-in-time-escape-rooms-operation-santas-list
California,Los Angeles,Key Quest: Dracula,https://worldofescapes.com/los-angeles/quests/60out-escape-rooms-dracula
California,Los Angeles,Escapedom: The Spaceship,https://worldofescapes.com/los-angeles/quests/the-room-la-the-spaceship
California,Los Angeles,Key Quest: Time Machine,https://worldofescapes.com/los-angeles/quests/60out-escape-rooms-time-machine
California,Los Angeles,Exit Game: Chapter 3: The Study,https://worldofescapes.com/los-angeles/quests/the-basement-the-study
California,Los Angeles,Escapedom: Vacation Vandals,https://worldofescapes.com/los-angeles/quests/Key-Quest-Vacation-Vandals-F
California,Los Angeles,Enigma Escape Rooms: The Cranial Carnival,https://worldofescapes.com/los-angeles/quests/escapedom-the-cranial-carnival
California,Los Angeles,Enigma Escape Rooms: The Cellar,https://worldofescapes.com/los-angeles/quests/The-Cellar-Key-Quest-F
California,Los Angeles,Enigma Escape Rooms: The School of Sorcery,https://worldofescapes.com/los-angeles/quests/exit-game-the-school-of-sorcery
California,Los Angeles,Famous Escape Games: The Lair,https://worldofescapes.com/los-angeles/quests/thelair-escapedom
California,Los Angeles,Escape Chronicles: Apartment 205,https://worldofescapes.com/los-angeles/quests/apartment205-la
California,Los Angeles,Enigma Escape Rooms: Crime Scene,https://worldofescapes.com/los-angeles/quests/enigma-escape-rooms-crime-scene
California,Los Angeles,Suite 201 Escape Room: The Will,https://worldofescapes.com/los-angeles/quests/enigma-escape-rooms-the-will
California,Los Angeles,Evil Genius Escape Rooms: The Great Redemption,https://worldofescapes.com/los-angeles/quests/the-great-redemption
California,Los Angeles,Escape Room Long Beach: Testing Facility,https://worldofescapes.com/los-angeles/quests/escape-chronicles-testing-facility
California,Los Angeles,Square Room Escape: The Seance,https://worldofescapes.com/los-angeles/quests/enigma-escape-rooms-seance
California,Los Angeles,Evil Genius Escape Rooms: DEA,https://worldofescapes.com/los-angeles/quests/suite-201-escape-room-dea
California,Los Angeles,Escape Chronicles: Chapter One: Occam's Apartment,https://worldofescapes.com/los-angeles/quests/evil-genius-escape-rooms-chapter-1
California,Los Angeles,Evil Genius Escape Rooms: Prohibition,https://worldofescapes.com/los-angeles/quests/escapelbc-prohibition
California,Los Angeles,Escape Room Long Beach: The Phantom Soldier,https://worldofescapes.com/los-angeles/quests/square-room-escape-phantom-soldier
California,Los Angeles,Escape Room Long Beach: Chapter Three: The Morgue,https://worldofescapes.com/los-angeles/quests/evil-genius-escape-rooms-the-morgue
California,Los Angeles,Enigma Escape Rooms: Smugglers Tunnels,https://worldofescapes.com/los-angeles/quests/escape-chronicles-smugglers-tunnels
California,Los Angeles,Suite 201 Escape Room: Chapter Two: Norcross Art Gallery,https://worldofescapes.com/los-angeles/quests/evil-genius-escape-rooms-chapter-2
California,Los Angeles,Enigma Escape Rooms: Bad Blood,https://worldofescapes.com/los-angeles/quests/escapelbc-bad-blood
California,Los Angeles,Suite 201 Escape Room: Hollywood Dreams,https://worldofescapes.com/los-angeles/quests/escape-room-long-beach-hollywood-dreams
California,Los Angeles,Famous Escape Games: The Secret Temple,https://worldofescapes.com/los-angeles/quests/secret-temple-la
California,Modesto,Escape Modesto: King Tut's Treasure,https://worldofescapes.com/modesto/quests/Escape-Modesto-King-Tuts-Treasure
California,Modesto,Escape Modesto: Prison Break 2.0,https://worldofescapes.com/modesto/quests/Escape-Modesto-Prison-Break
California,Modesto,EXIT Escape Room Adventures: Prof. Pittsburgs' National Treasure,https://worldofescapes.com/modesto/quests/exit-escape-room-adventures-prof-pittsburgs-national-treasure
California,Modesto,Escape Modesto: CSI: Modesto,https://worldofescapes.com/modesto/quests/Escape-Modesto-CSI-MODESTO
California,Modesto,The Excape Adventure: Classroom Lockdown,https://worldofescapes.com/modesto/quests/the-excape-adventure-classroom-lockdown
California,Modesto,Key Quest: Vacation Vandals,https://worldofescapes.com/modesto/quests/Key-Quest-Vacation-Vandals
California,Modesto,Key Quest: Detention,https://worldofescapes.com/modesto/quests/key-quest-modesto-detention
California,Modesto,Limitless Escape Games: Sherlock Holmes,https://worldofescapes.com/modesto/quests/limitless-escape-games-stockton-sherlock-holmes
California,Modesto,Limitless Escape Games: Wizard School,https://worldofescapes.com/modesto/quests/limitless-escape-games-stockton-wizard-school
California,Modesto,EXIT Escape Room Adventures: AgXscape,https://worldofescapes.com/modesto/quests/hilmar-cheese-company-agxscape
California,Modesto,Limitless Escape Games: Cursed Kingdom of Exitia,https://worldofescapes.com/modesto/quests/exit-escape-room-adventures-cursed-kingdom-of-exitia
California,Modesto,Limitless Escape Games: Bank Heist,https://worldofescapes.com/modesto/quests/limitless-escape-games-stockton-bank-heist
California,Modesto,Key Quest: Pirate Adventure,https://worldofescapes.com/modesto/quests/limitless-escape-games-stockton-pirate-adventure
California,Modesto,Stockton Escape: The Cellar,https://worldofescapes.com/modesto/quests/Key-Quest-The-Cellar
California,Modesto,Stockton Escape: The Study,https://worldofescapes.com/modesto/quests/stockton-escape-the-study
California,Modesto,Stockton Escape: Ex Machina,https://worldofescapes.com/modesto/quests/stockton-escape-ex-machina
California,Modesto,EXIT Escape Room Adventures: The Gallery,https://worldofescapes.com/modesto/quests/stockton-escape-the-gallery
California,Modesto,Limitless Escape Games: Pirate Adventure,https://worldofescapes.com/modesto/quests/limitless-escape-games-stockton-pirate-adventure
California,Oceanside,Codebreakers: Escape the Time Machine 2,https://worldofescapes.com/oceanside/quests/codebreakers-escape-the-time-machine
California,Oceanside,Boss-Play Escape Rooms: The Chocolate Factory,https://worldofescapes.com/oceanside/quests/boss-play-escape-rooms-the-chocolate-factory
California,Oceanside,School of Hard Locks: Escape from Summer Vacation,https://worldofescapes.com/oceanside/quests/school-of-hard-locks-summer-vacation
California,Oceanside,School of Hard Locks: Escape from Kindergarten,https://worldofescapes.com/oceanside/quests/school-of-hard-locks-kindergarten
California,Oceanside,Boss-Play Escape Rooms: Prohibition Ransom,https://worldofescapes.com/oceanside/quests/boss-play-escape-rooms-prohibition-ransom
California,Oceanside,Top Tier Escape Rooms: Atlantis,https://worldofescapes.com/oceanside/quests/top-tier-escape-rooms-atlantis
California,Oceanside,Codebreakers: The Atlantis Treasure Hunt,https://worldofescapes.com/oceanside/quests/codebreakers-the-atlantis-treasure-hunt
California,Oceanside,School of Hard Locks: Science Fair: Spells & Potions,https://worldofescapes.com/oceanside/quests/school-of-hard-locks-science-fair-spells-and-potions
California,Oceanside,Top Tier Escape Rooms: Yakuza,https://worldofescapes.com/oceanside/quests/top-tier-escape-rooms-yakuza
California,Oceanside,Boss-Play Escape Rooms: Neutrino 42,https://worldofescapes.com/oceanside/quests/boss-play-escape-rooms-neutrino-42
California,Oceanside,School of Hard Locks: Escape from P.E.,https://worldofescapes.com/oceanside/quests/school-of-hard-locks-escape-from-pe
California,Orange County,Fox in a Box: Cold War Bunker,https://worldofescapes.com/orange-county/quests/fox-in-a-box-orange-county-cold-war-bunker
California,Orange County,Fox in a Box: Zodiac Killer,https://worldofescapes.com/orange-county/quests/fox-in-a-box-orange-county-zodiac-killer
California,Orange County,Fox in a Box: Zombie Lab,https://worldofescapes.com/orange-county/quests/fox-in-a-box-orange-county-zombie-lab
California,Orange County,Immersion: Senseless,https://worldofescapes.com/orange-county/quests/immersion-orange-senseless
California,Orange County,Puzzle Workshop: Secrets of the Illuminati,https://worldofescapes.com/orange-county/quests/puzzle-workshop-secrets-of-the-illuminati
California,Orange County,Immersion: The Cursed,https://worldofescapes.com/orange-county/quests/immersion-orange-the-cursed
California,Orange County,Escape Long Beach: The Mystery of Stillwater Asylum,https://worldofescapes.com/orange-county/quests/kryptic-tales-the-mystery-of-stillwater-asylum
California,Orange County,Immersion: The Lab,https://worldofescapes.com/orange-county/quests/escape-long-beach-the-lab
California,Orange County,Escape Long Beach: The Manor,https://worldofescapes.com/orange-county/quests/immersion-orange-the-manor
California,Orange County,Escape the Place: The Queen,https://worldofescapes.com/orange-county/quests/escape-long-beach-the-queen
California,Orange County,Escape the Place: The Mad Rapper,https://worldofescapes.com/orange-county/quests/scenario-escape-room-the-mad-rapper
California,Orange County,Cinema Escape Rooms: Area 15,https://worldofescapes.com/orange-county/quests/escape-the-place-area-15
California,Orange County,Immersion: The Butcher,https://worldofescapes.com/orange-county/quests/escape-the-place-the-butcher
California,Orange County,Cinema Escape Rooms: The Strange Thing,https://worldofescapes.com/orange-county/quests/cinema-escape-room-the-strange-thing
California,Orange County,Escape the Place: Framed for Murder,https://worldofescapes.com/orange-county/quests/immersion-orange-framed-for-murder
California,Orange County,Fox in a Box: The Mystical Murderess,https://worldofescapes.com/orange-county/quests/code-red-the-mystical-murderess
California,Orange County,Immersion: Ark of the Covenant,https://worldofescapes.com/orange-county/quests/cinema-escape-room-ark-of-the-covenant
California,Orange County,Immersion: 303 Coulrophobia Ln.,https://worldofescapes.com/orange-county/quests/escape-the-place-303-coulrophobia-ln
California,Orange County,Immersion: Central Bank,https://worldofescapes.com/orange-county/quests/fox-in-a-box-orange-county-central-bank
California,Orange County,Immersion: The Mad Rapper,https://worldofescapes.com/orange-county/quests/scenario-escape-room-the-mad-rapper
California,Orange County,Escape the Place: The Manor,https://worldofescapes.com/orange-county/quests/immersion-orange-the-manor
California,Palm Springs,Escape Room Palm Springs: Locker Room,https://worldofescapes.com/palm-springs/quests/escape-room-palm-springs-the-locker-room
California,Palm Springs,Escape Room Palm Springs: Titanic Room,https://worldofescapes.com/palm-springs/quests/Escape-Room-Palm-Springs-The-Titanic-Room
California,Palm Springs,Escape Room Palm Springs: Merlin's Magic School,https://worldofescapes.com/palm-springs/quests/escape-room-palm-springs-merlins-magic-school
California,Palm Springs,Escape Room Palm Springs: Vampire's Lair,https://worldofescapes.com/palm-springs/quests/escape-room-palm-springs-vampires-lair
California,Palm Springs,Escape Room Palm Springs: Bank Heist,https://worldofescapes.com/palm-springs/quests/escape-room-palm-springs-bank-heist
California,Palm Springs,Escape Room Palm Springs: Jack the Ripper,https://worldofescapes.com/palm-springs/quests/escape-room-palm-springs-jack-the-ripper
California,Pomona,Unity Escape Rooms: Last Supper,https://worldofescapes.com/pomona/quests/quest-tavern-escape-room-last-supper
California,Pomona,Unity Escape Rooms: The Sword In The Study,https://worldofescapes.com/pomona/quests/gaslamp-the-sword-in-the-study
California,Pomona,Unity Escape Rooms: The Witch's Cauldron,https://worldofescapes.com/pomona/quests/quest-tavern-escape-room-the-witchs-cauldron
California,Pomona,Not Another Escape Room: Person of Interest,https://worldofescapes.com/pomona/quests/unity-escape-rooms-person-of-interest
California,Pomona,Not Another Escape Room: The Kitchen Nightmare,https://worldofescapes.com/pomona/quests/unity-escape-rooms-the-kitchen-nightmare
California,Pomona,Trapped! Escape Room: Tomb of the Pharaoh,https://worldofescapes.com/pomona/quests/unity-escape-rooms-tomb-of-the-pharaoh
California,Pomona,Breaking Point Escape Rooms: Designer's Studio,https://worldofescapes.com/pomona/quests/not-another-escape-room-designers-studio
California,Pomona,Unity Escape Rooms: Time Machine,https://worldofescapes.com/pomona/quests/not-another-escape-room-time-machine
California,Pomona,Breaking Point Escape Rooms: The Lair of the Puzzlemaster,https://worldofescapes.com/pomona/quests/trapped-escape-room-upland-the-lair-of-the-puzzlemaster
California,Pomona,Unity Escape Rooms: The Secret at Whitmore Estate,https://worldofescapes.com/pomona/quests/breaking-point-escape-rooms-the-secret-at-whitmore-estate
California,Pomona,Trapped! Escape Room: Locked Out!,https://worldofescapes.com/pomona/quests/unity-escape-rooms-locked-out
