state,city,company_and_room,woe_room_url
California,Yuba City,NorCal Escape Co.: Fox Tail Saloon,https://worldofescapes.com/yuba-city/quests/norcal-escape-co-fox-tail-saloon
California,Yuba City,NorCal Escape Co.: Escape Truck,https://worldofescapes.com/yuba-city/quests/norcal-escape-co-escape-truck
Colorado,Avon,Vail Valley Escape Room: The Marble Mountain Mine Mystery!,https://worldofescapes.com/avon/quests/vail-valley-escape-room-the-marble-mountain-mine-mystery
Colorado,Avon,Vail Valley Escape Room: Save The Mountain!,https://worldofescapes.com/avon/quests/vail-valley-escape-room-save-the-mountain
Colorado,Avon,Vail Valley Escape Room: Wizard School,https://worldofescapes.com/avon/quests/escape-room-vail-wizard-school
Colorado,Avon,Vail Valley Escape Room: Rocky Mountain Meltdown,https://worldofescapes.com/avon/quests/vail-valley-escape-room-rocky-mountain-meltdown
Colorado,Breckenridge,Escape Room Breckenridge: Secret Agent Room,https://worldofescapes.com/breckenridge/quests/escape-room-breckenridge-secret-agent-room
Colorado,Breckenridge,Escape Room Breckenridge: Captain Steelhook's Treasure,https://worldofescapes.com/breckenridge/quests/escape-room-breckenridge-captain-steelhooks-treasure
Colorado,Breckenridge,Mountain Time Escape Rooms: Boreas' Revenge - An Avalanche Survival Cabin,https://worldofescapes.com/breckenridge/quests/mountain-time-escape-rooms-boreas-revenge
Colorado,Breckenridge,Frisco Escape Room: Deuces Wild,https://worldofescapes.com/breckenridge/quests/frisco-escape-room-deuces-wild
Colorado,Breckenridge,Frisco Escape Room: Finders Keepers,https://worldofescapes.com/breckenridge/quests/frisco-escape-room-finders-keepers
Colorado,Breckenridge,Escape Room Breckenridge: Santa's Naughty List,https://worldofescapes.com/breckenridge/quests/escape-room-breckenridge-santas-naughty-list
Colorado,Breckenridge,Mountain Time Escape Rooms: Paranormal Mystery of Breckenridge,https://worldofescapes.com/breckenridge/quests/mountain-time-escape-rooms-paranormal-mystery
Colorado,Breckenridge,Escape Room Breckenridge: Wizard Room,https://worldofescapes.com/breckenridge/quests/escape-room-breckenridge-wizard-room
Colorado,Breckenridge,Mountain Time Escape Rooms: The Search for Sasquatch,https://worldofescapes.com/breckenridge/quests/mountain-time-escape-rooms-the-search-for-sasquatch
Colorado,Breckenridge,Real and Wild Entertainment: Carnival,https://worldofescapes.com/breckenridge/quests/real-and-wild-entertainment-carnival
Colorado,Colorado Springs,Planet Deadline Escape Rooms: A Colorado Slaycation,https://worldofescapes.com/colorado-springs/quests/planet-deadline-escape-rooms-a-colorado-slaycation
Colorado,Colorado Springs,Escape the Place: Timebomb,https://worldofescapes.com/colorado-springs/quests/escape-the-place-colorado-springs-timebomb
Colorado,Colorado Springs,Escape the Place: The Hangover,https://worldofescapes.com/colorado-springs/quests/escape-chambers-the-hangover
Colorado,Colorado Springs,The Greatest Escape Games: Cabin Fever,https://worldofescapes.com/colorado-springs/quests/the-greatest-escape-games-cabin-fever
Colorado,Colorado Springs,Escaped in Time: We're All Mad Here,https://worldofescapes.com/colorado-springs/quests/escaped-in-time-were-all-mad-here
Colorado,Colorado Springs,Locked In Escapes: Shattered Kingdom,https://worldofescapes.com/colorado-springs/quests/locked-in-escapes-shattered-kingdom
Colorado,Colorado Springs,Escaped in Time: The Lost Soul,https://worldofescapes.com/colorado-springs/quests/escaped-in-time-the-lost-soul
Colorado,Colorado Springs,Pikes Peak Escape Rooms: Death Row,https://worldofescapes.com/colorado-springs/quests/pikes-peak-escape-rooms-death-row
Colorado,Colorado Springs,Locked In Escapes: Darkness Falls,https://worldofescapes.com/colorado-springs/quests/locked-in-escapes-darkness-falls
Colorado,Colorado Springs,21 Keys Escape Rooms: The Speakeasy,https://worldofescapes.com/colorado-springs/quests/21-keys-escape-rooms-the-speakeasy
Colorado,Colorado Springs,Planet Deadline Escape Rooms: The Seventh Stone - Secrets of Abydos,https://worldofescapes.com/colorado-springs/quests/planet-deadline-escape-rooms-the-7th-stone
Colorado,Colorado Springs,Escape the Place: Blacksite,https://worldofescapes.com/colorado-springs/quests/escape-the-place-black-site
Colorado,Colorado Springs,Enter The Enigma: The Executive Order,https://worldofescapes.com/colorado-springs/quests/enter-the-enigma-the-executive-order
Colorado,Colorado Springs,Escaped in Time: Sweet Dreams,https://worldofescapes.com/colorado-springs/quests/escaped-in-time-sweet-dreams
Colorado,Colorado Springs,Planet Deadline Escape Rooms: Dark Sector,https://worldofescapes.com/colorado-springs/quests/planet-deadline-escape-rooms-dark-sector
Colorado,Colorado Springs,21 Keys Escape Rooms: Project Iceworm,https://worldofescapes.com/colorado-springs/quests/21-keys-escape-rooms-project-iceworm
Colorado,Colorado Springs,Locked In Escapes: Rockstar: The Final Curtain,https://worldofescapes.com/colorado-springs/quests/locked-in-escapes-rockstar
Colorado,Colorado Springs,Enter the Room: 999 Strange Place,https://worldofescapes.com/colorado-springs/quests/enter-the-room-999-strange-place
Colorado,Colorado Springs,Hellscream Haunted House: The Pen,https://worldofescapes.com/colorado-springs/quests/hellscream-room-escapes-the-pen
Colorado,Colorado Springs,Escape the Place: Quarantine,https://worldofescapes.com/colorado-springs/quests/escape-the-place-quarantine
Colorado,Colorado Springs,Enter The Enigma: Professor's Study,https://worldofescapes.com/colorado-springs/quests/enter-the-enigma-professors-study
Colorado,Colorado Springs,21 Keys Escape Rooms: Fried Chicken,https://worldofescapes.com/colorado-springs/quests/21-keys-escape-rooms-fried-chicken
Colorado,Colorado Springs,Hellscream Haunted House: The Manor,https://worldofescapes.com/colorado-springs/quests/escape-chamber-hels-manor
Colorado,Colorado Springs,The Greatest Escape Games: Inventor's Workshop,https://worldofescapes.com/colorado-springs/quests/the-greatest-escape-games-inventors-workshop
Colorado,Colorado Springs,Pikes Peak Escape Rooms: The Lost Kingdom,https://worldofescapes.com/colorado-springs/quests/pikes-peak-escape-rooms-the-lost-kingdom
Colorado,Colorado Springs,Hellscream Haunted House: The Elevator,https://worldofescapes.com/colorado-springs/quests/hellscream-room-escapes-the-elevator
Colorado,Colorado Springs,Locked In Escapes: The Infected,https://worldofescapes.com/colorado-springs/quests/locked-in-escapes-the-infected
Colorado,Colorado Springs,Enter The Enigma: Welcome to Enigma High,https://worldofescapes.com/colorado-springs/quests/enter-the-enigma-welcome-to-enigma-high
Colorado,Colorado Springs,Pikes Peak Escape Rooms: Strange Brew,https://worldofescapes.com/colorado-springs/quests/pikes-peak-escape-rooms-strange-brew
Colorado,Colorado Springs,21 Keys Escape Rooms: Derailed,https://worldofescapes.com/colorado-springs/quests/21-keys-escape-rooms-derailed
Colorado,Colorado Springs,Escape the Place: The Chamber,https://worldofescapes.com/colorado-springs/quests/escape-the-place-the-chamber
Colorado,Colorado Springs,Enter the Room: The Medieval Library,https://worldofescapes.com/colorado-springs/quests/Enter-the-Room-The-Medieval-Library
Colorado,Colorado Springs,The Greatest Escape Games: Santa's Naughty List,https://worldofescapes.com/colorado-springs/quests/the-greatest-escape-games-santas-naughty-list
Colorado,Colorado Springs,Escaped in Time: The Attic,https://worldofescapes.com/colorado-springs/quests/escaped-in-time-the-attic
Colorado,Colorado Springs,Sly Fox Escapes: The Ancient Temple,https://worldofescapes.com/colorado-springs/quests/sly-fox-escapes-the-ancient-temple
Colorado,Colorado Springs,Sly Fox Escapes: Dr. Madd Steals Christmas,https://worldofescapes.com/colorado-springs/quests/sly-fox-escapes-the-madd-doctor
Colorado,Colorado Springs,The Greatest Escape Games: Scandal,https://worldofescapes.com/colorado-springs/quests/the-greatest-escape-games-scandal
Colorado,Colorado Springs,Mystery Quests: World War II - 10th Mountain Division,https://worldofescapes.com/colorado-springs/quests/mystery-quests-WWII-10th-mountain-division
Colorado,Colorado Springs,Mystery Quests: Lethal Lab Level 3,https://worldofescapes.com/colorado-springs/quests/mystery-quests-lethal-lab-level-3
Colorado,Colorado Springs,Mystery Quests: Egyptian Heist,https://worldofescapes.com/colorado-springs/quests/mystery-quests-egypt-room
Colorado,Colorado Springs,Sly Fox Escapes: C'thulhu Awakens,https://worldofescapes.com/colorado-springs/quests/sly-fox-escapes-cthulhu-awakens
Colorado,Colorado Springs,Mystery Quests: 1889 Butch Cassidy's Bank Robbery,https://worldofescapes.com/colorado-springs/quests/mystery-quests-1889
Colorado,Colorado Springs,The Greatest Escape Games: Rightful Heir,https://worldofescapes.com/colorado-springs/quests/the-greatest-escape-games-rightful-heir
Colorado,Colorado Springs,Pikes Peak Escape Rooms: Headless Horse Man,https://worldofescapes.com/colorado-springs/quests/pikes-peak-escape-rooms-headless-horse-man
Colorado,Denver,"""King's Escape Room"": Rock n Roll",https://worldofescapes.com/denver/quests/kings-escape-room-denver-rock-n-roll
Colorado,Denver,Sprightly Escapes: Weekend Get-AWAY,https://worldofescapes.com/denver/quests/sprightly-escapes-weekend-get-away
Colorado,Denver,Conundrum Escape Rooms: Cabin in the Woods,https://worldofescapes.com/denver/quests/Conundrum-Escape-Rooms-Cabin-in-the-Woods
Colorado,Denver,Puzzle Effect: Grim Stacks: Books & Bindings,https://worldofescapes.com/denver/quests/denver-escape-room-grim-stacks-books-and-bindings
Colorado,Denver,"""King's Escape Room"": Return to the Throne",https://worldofescapes.com/denver/quests/kings-escape-room-denver-return-to-the-throne
Colorado,Denver,Sprightly Escapes: Mission Improbable,https://worldofescapes.com/denver/quests/sprightly-escapes-mission-improbable
Colorado,Denver,Epic Escape Game: Happy Campers,https://worldofescapes.com/denver/quests/epic-escape-game-happy-campers
Colorado,Denver,Conundrum Escape Rooms: Mystic Chamber,https://worldofescapes.com/denver/quests/Conundrum-Escape-Rooms-Mystic-Chambers
Colorado,Denver,ROOM 5280: The Dark Room,https://worldofescapes.com/denver/quests/room-5280-the-dark-room
Colorado,Denver,The Clue Room: 1893,https://worldofescapes.com/denver/quests/the-clue-room-1893
Colorado,Denver,ROOM 5280: Weird Heritage,https://worldofescapes.com/denver/quests/room-5280-weird-heritage
Colorado,Denver,The Clue Room: Sherlocked,https://worldofescapes.com/denver/quests/the-clue-room-spy-ops
Colorado,Denver,EscapeWorks Denver: War Games,https://worldofescapes.com/denver/quests/escapeworks-denver-war-games
Colorado,Denver,Escapology: Arizona Shootout,https://worldofescapes.com/denver/quests/escapology-denver-arizona-shootout
Colorado,Denver,Escapology: Shanghaied,https://worldofescapes.com/denver/quests/escapology-denver-shanghaied
Colorado,Denver,Puzzle Effect: Amnesia,https://worldofescapes.com/denver/quests/denver-escape-room-amnesia
Colorado,Denver,Escape the Room: The Theater,https://worldofescapes.com/denver/quests/escape-the-room-denver-the-theater
Colorado,Denver,Puzzah!: M.A.S.K.,https://worldofescapes.com/denver/quests/puzzah-mask
Colorado,Denver,EscapeWorks Denver: Casino Heist,https://worldofescapes.com/denver/quests/escapeworks-denver-casino-heist
Colorado,Denver,Escape the Room: Western Bank Heist,https://worldofescapes.com/denver/quests/escape-the-room-denver-western-bank-heist
Colorado,Denver,Bible Treks Christian Escape Room: Shipwrecked with St. Paul,https://worldofescapes.com/denver/quests/bible-treks-escape-room-shipwrecked-with-st-paul
Colorado,Denver,Themescape: The Gate,https://worldofescapes.com/denver/quests/themescape-escape-rooms-the-gate
Colorado,Denver,The Clue Room:  Matter of the Mad Hatter,https://worldofescapes.com/denver/quests/the-clue-room-alices-whimsical-wonderland
Colorado,Denver,Epic Escape Game: The Teddy Bear Workshop,https://worldofescapes.com/denver/quests/epic-escape-game-the-teddy-bear-workshop
Colorado,Denver,Escape the Room: Meltdown,https://worldofescapes.com/denver/quests/escape-the-room-denver-meltdown
Colorado,Denver,Bible Treks Christian Escape Room: Mystery Aboard the Titanic,https://worldofescapes.com/denver/quests/bible-treks-escape-room-mystery-aboard-the-titanic
Colorado,Denver,Epic Escape Game: It's a Holodeck Mr. Holmes,https://worldofescapes.com/denver/quests/epic-escape-game-its-a-holodeck-mr-holmes
Colorado,Denver,ROOM 5280: The Heist,https://worldofescapes.com/denver/quests/room-5280-the-heist
Colorado,Denver,Golden Puzzle Room: The Lighthouse,https://worldofescapes.com/denver/quests/golden-puzzle-room-the-lighthouse
Colorado,Denver,Conundrum Escape Rooms: Submersion,https://worldofescapes.com/denver/quests/conundrum-escape-rooms-submersion
Colorado,Denver,Mission Escapes: Lunar Escape,https://worldofescapes.com/denver/quests/mission-escapes-lunar-escape
Colorado,Denver,Epic Escape Game: Conspiracy Theory,https://worldofescapes.com/denver/quests/epic-escape-game-conspiracy-theory
Colorado,Denver,The Clue Room: Clue Dunnit?,https://worldofescapes.com/denver/quests/the-clue-room-clue-dunnit
Colorado,Denver,Colorado Escape: Old West Heist,https://worldofescapes.com/denver/quests/colorado-escape-silence-of-the-lamb
Colorado,Denver,Escape the Room: Cartman's Escape Room,https://worldofescapes.com/denver/quests/escape-the-room-denver-cartmans-escape-room
Colorado,Denver,Denver Escape Room: Pipe Works,https://worldofescapes.com/denver/quests/denver-escape-room-pipe-works
Colorado,Denver,Colorado Escape: Wizards & Warlords,https://worldofescapes.com/denver/quests/colorado-escape-wizards-and-warlords
Colorado,Denver,Escapology: Under Pressure,https://worldofescapes.com/denver/quests/escapology-denver-under-pressure
Colorado,Denver,Golden Puzzle Room: Strike it Rich!,https://worldofescapes.com/denver/quests/golden-puzzle-room-strike-it-rich
Colorado,Denver,ROOM 5280: The Experiment,https://worldofescapes.com/denver/quests/room-5280-the-experiment
Colorado,Denver,Themescape: The Terminal,https://worldofescapes.com/denver/quests/themescape-escape-rooms-the-terminal
Colorado,Denver,Colorado Escape: Blackout Gold Mine,https://worldofescapes.com/denver/quests/colorado-escape-blackout-gold-mine
Colorado,Denver,Rabbit Hole Recreation Services: Paradox,https://worldofescapes.com/denver/quests/rabbit-hole-recreation-services-paradox
Colorado,Denver,Puzzle Effect: The Path,https://worldofescapes.com/denver/quests/denver-escape-room-the-path
Colorado,Denver,Escapology: Cuban Crisis,https://worldofescapes.com/denver/quests/escapology-denver-cuban-crisis
Colorado,Denver,Escapology: Th3 C0d3,https://worldofescapes.com/denver/quests/escapology-denver-the-code
Colorado,Denver,Golden Puzzle Room: Rocky Mountain Zephyr,https://worldofescapes.com/denver/quests/golden-puzzle-room-rocky-mountain-zephyr
Colorado,Denver,Golden Puzzle Room: The Nightingale,https://worldofescapes.com/denver/quests/golden-puzzle-room-the-nightingale
Colorado,Denver,Mission Escapes: Treasure Hunt,https://worldofescapes.com/denver/quests/mission-escapes-treasure-hunt
Colorado,Denver,Escapology: Budapest Express,https://worldofescapes.com/denver/quests/escapology-denver-budapest-express
Colorado,Denver,The Clue Room: Spy Chambers,https://worldofescapes.com/denver/quests/the-clue-room-spy-chamber-1
Colorado,Denver,Epic Escape Game: Red Planet,https://worldofescapes.com/denver/quests/epic-escape-game-red-planet
Colorado,Denver,Puzzle Effect: Private Detective Agency: Knight & Rook Investigations,https://worldofescapes.com/denver/quests/denver-escape-room-private-detective-agency
Colorado,Denver,Escapology: Antidote,https://worldofescapes.com/denver/quests/escapology-denver-antidote
Colorado,Denver,EscapeWorks Denver: Beyond the Flower Shop,https://worldofescapes.com/denver/quests/escapeworks-denver-beyond-the-flower-shop
Colorado,Denver,EscapeWorks Denver: Egyptian Tomb,https://worldofescapes.com/denver/quests/escapeworks-denver-egyptian-tomb
Colorado,Denver,The Clue Room: Nautilus,https://worldofescapes.com/denver/quests/the-clue-room-nautilus
Colorado,Denver,Themescape: The Stolen Relic,https://worldofescapes.com/denver/quests/themescape-escape-rooms-the-stolen-relic
Colorado,Denver,Epic Escape Game: Wizard’s Academy,https://worldofescapes.com/denver/quests/epic-escape-game-wizards-academy
Colorado,Denver,Epic Escape Game: Excalibur,https://worldofescapes.com/denver/quests/epic-escape-game-excalibur
Colorado,Denver,The Clue Room: The Shadow Gallery,https://worldofescapes.com/denver/quests/the-clue-room-the-shadow-gallery
Colorado,Denver,Colorado Escape: Asylum,https://worldofescapes.com/denver/quests/colorado-escape-asylum
Colorado,Denver,Bible Treks Christian Escape Room: The Finding at Christenson Manor,https://worldofescapes.com/denver/quests/bible-treks-escape-room-the-finding-at-christenson-manor
Colorado,Denver,Golden Puzzle Room: First Mission,https://worldofescapes.com/denver/quests/golden-puzzle-room-first-mission
Colorado,Denver,Conundrum Escape Rooms: Dead Man's Secret,https://worldofescapes.com/denver/quests/conundrum-escape-rooms-dead-mans-secret
Colorado,Denver,Rabbit Hole Recreation Services: Ruins of the Mystic Temple,https://worldofescapes.com/denver/quests/rabbit-hole-recreation-services-ruins-of-the-mystic-temple
Colorado,Denver,Epic Escape Game: The Quest,https://worldofescapes.com/denver/quests/epic-escape-game-a-heros-adventure
Colorado,Denver,ROOM 5280: Sherlock,https://worldofescapes.com/denver/quests/room-5280-sherlock
Colorado,Denver,Puzzle Effect: Curse on the Emerald Seas,https://worldofescapes.com/denver/quests/denver-escape-room-curse-on-the-emerald-seas
Colorado,Denver,EscapeWorks Denver: Outbreak,https://worldofescapes.com/denver/quests/escapeworks-denver-outbreak
Colorado,Denver,HD Escape Rooms: Wizarding World,https://worldofescapes.com/denver/quests/hd-escape-rooms-westminster-wizarding-world
Colorado,Denver,HD Escape Rooms: The Haunted Mansion,https://worldofescapes.com/denver/quests/hd-escape-rooms-the-haunted-mansion
Colorado,Denver,Conundrum Escape Rooms: The Hollywood Mystery: A Room Noir,https://worldofescapes.com/denver/quests/conundrum-escape-rooms-the-hollywood-mystery-a-room-noir
Colorado,Denver,Key Quest: The Cellar,https://worldofescapes.com/denver/quests/Key-Quest-The-Cellar
Colorado,Denver,HD Escape Rooms: The Lost Temple,https://worldofescapes.com/denver/quests/hd-escape-rooms-the-lost-temple
Colorado,Denver,Puzzle Effect: R.E.S.C.U.E.,https://worldofescapes.com/denver/quests/denver-escape-room-rescue
Colorado,Denver,"""King's Escape Room"": Fenn's Gold",https://worldofescapes.com/denver/quests/kings-escape-room-denver-fenns-gold
Colorado,Denver,Colorado Escape: Jurassic Escape,https://worldofescapes.com/denver/quests/colorado-escape-jurassic-escape
Colorado,Denver,HD Escape Rooms: A Quiet Place,https://worldofescapes.com/denver/quests/hd-escape-rooms-westminster-a-quiet-place
Colorado,Denver,The Escapist: Excalibur,https://worldofescapes.com/denver/quests/the-escapist-denver-excalibur
Colorado,Denver,Conundrum Escape Rooms: Experiment C73,https://worldofescapes.com/denver/quests/conundrum-escape-rooms-experiment-c73
Colorado,Denver,Colorado Escape: Casino Heist,https://worldofescapes.com/denver/quests/colorado-escape-casino-heist
Colorado,Denver,The Escapist: Room 303,https://worldofescapes.com/denver/quests/303-escape-room-303
Colorado,Denver,Mystic Escape Room: The Black Hole,https://worldofescapes.com/denver/quests/the-escapist-denver-the-black-hole
Colorado,Denver,Escapology: The Book of Souls,https://worldofescapes.com/denver/quests/mystic-escape-room-the-book-of-souls
Colorado,Denver,Colorado Escape: Mansion Murder,https://worldofescapes.com/denver/quests/escapology-denver-mansion-murder
Colorado,Denver,The Wreck Room Escape Game: Airplane Crash,https://worldofescapes.com/denver/quests/colorado-escape-airplane-crash
Colorado,Denver,HD Escape Rooms: Area 51,https://worldofescapes.com/denver/quests/the-wreck-room-escape-game-area-51
Colorado,Denver,Mystic Escape Room: Caribbean Curse,https://worldofescapes.com/denver/quests/hd-escape-rooms-caribbean-curse
Colorado,Denver,Key Quest: The Amulet of Time,https://worldofescapes.com/denver/quests/mystic-escape-room-the-amulet-of-time
Colorado,Denver,The Wreck Room Escape Game: Vacation Vandals,https://worldofescapes.com/denver/quests/Key-Quest-Vacation-Vandals
Colorado,Denver,"""Try'n Escape"": The Upside Down",https://worldofescapes.com/denver/quests/the-wreck-room-escape-game-the-upside-down
Colorado,Denver,Epic Escape Game: Passengers in Peril,https://worldofescapes.com/denver/quests/try-n-escape-passengers-in-peril
Colorado,Denver,The Escapist: Save Christmas!,https://worldofescapes.com/denver/quests/epic-escape-game-save-christmas
Colorado,Denver,The Escapist: Happy Hour,https://worldofescapes.com/denver/quests/the-escapist-denver-happy-hour
Colorado,Denver,"""King's Escape Room"": South Spy-cific",https://worldofescapes.com/denver/quests/the-escapist-denver-south-spy-cific
Colorado,Denver,HD Escape Rooms: Curse of the Billy Goat,https://worldofescapes.com/denver/quests/kings-escape-room-denver-curse-of-the-billy-goat
Colorado,Denver,Sprightly Escapes: Area 51,https://worldofescapes.com/denver/quests/hd-escape-rooms-westminster-area-51
Colorado,Denver,Mystic Escape Room: The Work Place: Office Party,https://worldofescapes.com/denver/quests/sprightly-escapes-the-work-place-office-party
Colorado,Denver,HD Escape Rooms: The Pink Panther,https://worldofescapes.com/denver/quests/mystic-escape-room-the-pink-panther
Colorado,Denver,The Wreck Room Escape Game: The Mine Shaft,https://worldofescapes.com/denver/quests/hd-escape-rooms-westminster-the-mine-shaft
Colorado,Denver,Rabbit Hole Recreation Services: Mummy Tomb,https://worldofescapes.com/denver/quests/the-wreck-room-escape-game-mummy-tomb
Colorado,Denver,Key Quest: Frost Base Z,https://worldofescapes.com/denver/quests/rabbit-hole-recreation-services-frost-base-z
Colorado,Denver,Epic Escape Game: Detention,https://worldofescapes.com/denver/quests/key-quest-denver-detention
Colorado,Denver,Epic Escape Game: Dorm of the Dead 2,https://worldofescapes.com/denver/quests/epic-escape-game-dorm-of-the-dead
Colorado,Denver,Colorado Escape: Lab Disaster,https://worldofescapes.com/denver/quests/epic-escape-game-lab-disaster
Colorado,Denver,"""Try'n Escape"": Star Wars",https://worldofescapes.com/denver/quests/colorado-escape-games-of-thrones
Colorado,Denver,Epic Escape Game: Saloon Showdown,https://worldofescapes.com/denver/quests/try-n-escape-saloon-showdown
Colorado,Denver,Epic Escape Game: Super Powers,https://worldofescapes.com/denver/quests/epic-escape-game-super-powers
Colorado,Denver,Colorado Escape: The Cursed Vault,https://worldofescapes.com/denver/quests/epic-escape-game-the-cursed-vault
Colorado,Denver,Epic Escape Game: Area 51,https://worldofescapes.com/denver/quests/colorado-escape-area-51
Colorado,Denver,Escape the Room: The President's Briefcase,https://worldofescapes.com/denver/quests/epic-escape-game-the-presidents-briefcase
Colorado,Denver,The Clue Room: Jurassic Escape,https://worldofescapes.com/denver/quests/escape-the-room-denver-jurassic-escape
Colorado,Denver,Epic Escape Game: Bootlegger's Breakout,https://worldofescapes.com/denver/quests/the-clue-room-bootleggers-breakout
Colorado,Denver,Escape the Room: Dinner at the Manor,https://worldofescapes.com/denver/quests/epic-escape-game-dinner-at-the-manor
Colorado,Denver,"""Try'n Escape"": The Submarine",https://worldofescapes.com/denver/quests/escape-the-room-denver-the-submarine
Colorado,Denver,Puzzah!: Sinking Ship,https://worldofescapes.com/denver/quests/try-n-escape-sinking-ship
Colorado,Denver,Great Room Escape: Specimen,https://worldofescapes.com/denver/quests/puzzah-specimen
Colorado,Denver,Puzzah!: Cabin Room,https://worldofescapes.com/denver/quests/The-Great-Room-Escape-Then-Cabin
Colorado,Denver,Puzzah!: Tick Tock,https://worldofescapes.com/denver/quests/puzzah-tick-tock
Colorado,Denver,Puzzah!: Kazam!,https://worldofescapes.com/denver/quests/puzzah-kazam
Colorado,Denver,Great Room Escape: The Steal,https://worldofescapes.com/denver/quests/puzzah-the-steal
Colorado,Denver,Epic Escape Game: Zombie,https://worldofescapes.com/denver/quests/great-room-escape-denver-zombie
Colorado,Denver,Epic Escape Game: Pikes Peak or Bust: Colorado’s Gold Rush,https://worldofescapes.com/denver/quests/epic-escape-game-pikes-peak-o-bust
Colorado,Denver,Puzzah!: The Inventor's Garage,https://worldofescapes.com/denver/quests/epic-escape-game-the-inventors-garage
Colorado,Denver,Denver Escape Room: I.R.I.S.,https://worldofescapes.com/denver/quests/puzzah-iris
Colorado,Denver,Epic Escape Game: The Crimson Storm,https://worldofescapes.com/denver/quests/denver-escape-room-the-crimson-storn
Colorado,Denver,Themescape: Sweet Dreams,https://worldofescapes.com/denver/quests/epic-escape-game-sweet-dreams
Colorado,Denver,Denver Escape Room: The Secret Catacombs,https://worldofescapes.com/denver/quests/themeescape-escape-rooms-the-secret-catacombs
Colorado,Denver,Themescape: Rampancy,https://worldofescapes.com/denver/quests/Denver-Escape-Room-Rampancy
Colorado,Denver,Colorado Escape: Sector X,https://worldofescapes.com/denver/quests/themeescape-escape-rooms-spaceescape
Colorado,Denver,"""Try'n Escape"": Kidnapped!",https://worldofescapes.com/denver/quests/colorado-escape-kidnapped
Colorado,Denver,Time to Escape: Money Madness,https://worldofescapes.com/denver/quests/try-n-escape-money-madness
Colorado,Denver,Epic Escape Game: Flashback ,https://worldofescapes.com/denver/quests/time-to-escape-flashback
Colorado,Denver,Epic Escape Game: Buried Alive - the Curse of Octavia,https://worldofescapes.com/denver/quests/epic-escape-game-buried-alive-the-curse-of-octavia
Colorado,Denver,Time to Escape: The Lost Continent,https://worldofescapes.com/denver/quests/epic-escape-game-the-lost-continent
