state,city,company_and_room,woe_room_url
Alabama,Auburn,Auburn Escape Zones: Imprisoned,https://worldofescapes.com/auburn/quests/auburn-escape-zones-imprisoned
Alabama,Auburn,Auburn Escape Zones: The Cabin,https://worldofescapes.com/auburn/quests/auburn-escape-zones-the-cabin
Alabama,Auburn,Auburn Escape Zones: Vault,https://worldofescapes.com/auburn/quests/auburn-escape-zones-vault
Alabama,Auburn,Auburn Escape Zones: The Puzzler vs Superheroes,https://worldofescapes.com/auburn/quests/auburn-escape-zones-the-puzzler-vs-superheroes
Alabama,Auburn,Auburn Escape Zones: Black Beard's Brig,https://worldofescapes.com/auburn/quests/auburn-escape-zones-black-beards-brig
Alabama,Birmingham,Breakout Games: The Kidnapping,https://worldofescapes.com/birm/quests/Breakout-Birmingham-The-Kidnapping
Alabama,Birmingham,Breakout Games: Runaway Train,https://worldofescapes.com/birm/quests/breakout-games-birmingham-runaway-train
Alabama,Birmingham,Breakout Games: Museum Heist,https://worldofescapes.com/birm/quests/Breakout-Birmingham-The-Musuem-Heist
Alabama,Birmingham,Breakout Games: Do Not Disturb,https://worldofescapes.com/birm/quests/breakout-games-birmingham-do-not-disturb
Alabama,Birmingham,Breakout Games: Mystery Mansion,https://worldofescapes.com/birm/quests/breakout-games-atlanta-mystery-mansion
Alabama,Birmingham,Breakout Games: Submarine Survival,https://worldofescapes.com/birm/quests/breakout-games-birmingham-submarine-survival
Alabama,Birmingham,Breakout Games: Undercover Alley,https://worldofescapes.com/birm/quests/breakout-games-birmingham-undercover-alley
Alabama,Birmingham,Breakout Games: Island Escape,https://worldofescapes.com/birm/quests/Breakout-Birmingham-Island-Escape
Alabama,Birmingham,Nightmare at 3008: Camp Mary Lee,https://worldofescapes.com/birm/quests/nightmare-at-3008-camp-mary-lee
Alabama,Birmingham,Nightmare at 3008: The Underground,https://worldofescapes.com/birm/quests/nightmare-at-3008-the-underground
Alabama,Birmingham,Nightmare at 3008: House Of Voodoo,https://worldofescapes.com/birm/quests/nightmare-at-3008-3008-house
Alabama,Birmingham,Locked In: The Laboratory,https://worldofescapes.com/birm/quests/Locked-In-THE-LABORATORY
Alabama,Birmingham,Locked In: The Classroom,https://worldofescapes.com/birm/quests/locked-in-birm-the-classroom
Alabama,Birmingham,Locked In: The Warehouse,https://worldofescapes.com/birm/quests/Locked-In-THE-WAREHOUSE
Alabama,Birmingham,Train Escape: Sabotage,https://worldofescapes.com/birm/quests/train-escape-sabotage
Alabama,Birmingham,Train Escape: Classified,https://worldofescapes.com/birm/quests/train-escape-classified
Alabama,Birmingham,Locked In: The Museum,https://worldofescapes.com/birm/quests/Locked-In-THE-MUSEUM
Alabama,Daleville,Brain Busters Escape Rooms: The Grove,https://worldofescapes.com/daleville/quests/brain-busters-escape-rooms-the-grove
Alabama,Daleville,Brain Busters Escape Rooms: Out of Order,https://worldofescapes.com/daleville/quests/brain-busters-escape-rooms-out-of-order
Alabama,Daleville,Brain Busters Escape Rooms: Booty Battle,https://worldofescapes.com/daleville/quests/brain-busters-escape-rooms-booty-battle
Alabama,Daleville,Escape Enterprise: The Secret Society,https://worldofescapes.com/daleville/quests/escape-enterprise-the-secret-society
Alabama,Daleville,Brain Busters Escape Rooms: Bio Lab,https://worldofescapes.com/daleville/quests/brain-busters-escape-rooms-bio-lab
Alabama,Daleville,Escape Enterprise: The Shack,https://worldofescapes.com/daleville/quests/escape-enterprise-the-shack
Alabama,Daleville,Escape Enterprise: The Box,https://worldofescapes.com/daleville/quests/escape-enterprise-the-box
Alabama,Daleville,Brain Busters Escape Rooms: Wizard Quest,https://worldofescapes.com/daleville/quests/brain-busters-escape-rooms-wizard-quest
Alabama,Dothan,Escape Dothan: The 13th Floor,https://worldofescapes.com/dothan/quests/escape-dothan-the-13th-floor
Alabama,Dothan,Escape Dothan: Murder at the Mansion,https://worldofescapes.com/dothan/quests/escape-dothan-murder-at-the-mansion
Alabama,Dothan,Escape Dothan: Time Warp,https://worldofescapes.com/dothan/quests/escape-dothan-time-warp
Alabama,Dothan,Escape Dothan: Bazaar Battle,https://worldofescapes.com/dothan/quests/escape-dothan-bazaar-battle
Alabama,Florence (AL),Escape Room Florence: Espionage,https://worldofescapes.com/florence-al/quests/escape-room-florence-espionage
Alabama,Florence (AL),Escape Room Florence: Lost Cabin,https://worldofescapes.com/florence-al/quests/escape-room-florence-lost-cabin
Alabama,Florence (AL),Escape Room Florence: Sound Escape,https://worldofescapes.com/florence-al/quests/escape-room-florence-sound-escape
Alabama,Florence (AL),Escape Room Florence: Bio-Hazard Bunker,https://worldofescapes.com/florence-al/quests/escape-room-florence-bio-hazard-bunker
Alabama,Gadsden,beat60: The Darkness,https://worldofescapes.com/gadsden/quests/beat60-the-darkness
Alabama,Gadsden,beat60: The Captain,https://worldofescapes.com/gadsden/quests/beat60-the-captain
Alabama,Gadsden,beat60: Jewel Thief,https://worldofescapes.com/gadsden/quests/beat60-jewel-thief
Alabama,Henagar,Escape Room Adventures: Zombie Escape,https://worldofescapes.com/henagar/quests/escape-room-adventures-zombie-escape
Alabama,Henagar,Escape Room Adventures: Dash For The Cash!,https://worldofescapes.com/henagar/quests/escape-room-adventures-dash-for-the-cash
Alabama,Huntsville,Huntsville Escape Rooms: The Queen Pin,https://worldofescapes.com/huntsville/quests/huntsville-escape-rooms-the-queen-pin
Alabama,Huntsville,Huntsville Escape Rooms: The Informant,https://worldofescapes.com/huntsville/quests/Huntsville-Escape-Rooms-The-Informant
Alabama,Huntsville,Huntsville Escape Rooms: The Psych Ward,https://worldofescapes.com/huntsville/quests/Huntsville-Escape-Rooms-The-Psyche-Ward
Alabama,Huntsville,Huntsville Escape Rooms: The Hexadron,https://worldofescapes.com/huntsville/quests/huntsville-escape-rooms-the-hexadron
Alabama,Huntsville,Huntsville Escape Rooms: The New Atlantis,https://worldofescapes.com/huntsville/quests/huntsville-escape-rooms-the-new-atlantis
Alabama,Huntsville,Escapology: Budapest Express,https://worldofescapes.com/huntsville/quests/escapology-huntsville-budapest-express
Alabama,Huntsville,Huntsville Escape Rooms: The Executioner,https://worldofescapes.com/huntsville/quests/huntsville-escape-rooms-the-executioner
Alabama,Huntsville,Escapology: Antidote,https://worldofescapes.com/huntsville/quests/escapology-huntsville-antidote
Alabama,Huntsville,Escapology: Under Pressure,https://worldofescapes.com/huntsville/quests/escapology-huntsville-under-pressure
Alabama,Huntsville,Trapped In Decatur: Escape from Alcatraz,https://worldofescapes.com/huntsville/quests/trapped-in-decatur-escape-from-alcatraz
Alabama,Huntsville,Trapped In Decatur: The Bank Robbery,https://worldofescapes.com/huntsville/quests/trapped-in-decatur-the-bank-robbery
Alabama,Huntsville,Trapped In Decatur: The Morgue of Dr. G. Reaper,https://worldofescapes.com/huntsville/quests/trapped-in-decatur-the-morgue-of-dr-g-reaper
Alabama,Huntsville,Trapped In Decatur: Treasure of the Emerald Isles,https://worldofescapes.com/huntsville/quests/trapped-in-decatur-treasure-of-the-emerald-isles
Alabama,Mobile,Breakout Games: The Kidnapping,https://worldofescapes.com/mobile/quests/breakout-mobile-the-kidnapping
Alabama,Mobile,Breakout Games: Operation: Casino,https://worldofescapes.com/mobile/quests/breakout-mobile-casino-royale
Alabama,Mobile,Breakout Games: Hostage,https://worldofescapes.com/mobile/quests/breakout-mobile-hostage
Alabama,Mobile,Breakout Games: Museum Heist,https://worldofescapes.com/mobile/quests/breakout-mobile-the-museum-heist
Alabama,Mobile,Breakout Games: Island Escape,https://worldofescapes.com/mobile/quests/breakout-mobile-island-escape
Alabama,Mobile,Fairhope Escape Rooms: Night Bandit Treasure,https://worldofescapes.com/mobile/quests/fairhope-escape-rooms-night-bandit-treasure
Alabama,Montgomery,Escapology: Antidote,https://worldofescapes.com/montgomery/quests/escapology-montgomery-antidote
Alabama,Montgomery,Escapology: Cuban Crisis,https://worldofescapes.com/montgomery/quests/escapology-montgomery-cuban-crisis
Alabama,Montgomery,Escapology: Budapest Express,https://worldofescapes.com/montgomery/quests/escapology-montgomery-budapest-express
Alabama,Montgomery,Escapology: Arizona Shootout,https://worldofescapes.com/montgomery/quests/escapology-montgomery-arizona-shootout
Alabama,Montgomery,Escapology: Shanghaied,https://worldofescapes.com/montgomery/quests/escapology-montgomery-shanghaied
Alabama,Montgomery,Escapology: Th3 C0d3,https://worldofescapes.com/montgomery/quests/escapology-montgomery-the-code
Alabama,Montgomery,Breakout Games: Hostage,https://worldofescapes.com/montgomery/quests/breakout-montgomery-hostage
Alabama,Montgomery,Breakout Games: The Kidnapping,https://worldofescapes.com/montgomery/quests/breakout-montgomery-the-kidnapping
Alabama,Montgomery,Breakout Games: Museum Heist,https://worldofescapes.com/montgomery/quests/breakout-montgomery-museum-heist
Alabama,Montgomery,Breakout Games: Mystery Mansion,https://worldofescapes.com/montgomery/quests/breakout-games-montgomery-mystery-mansion
Alabama,Montgomery,Breakout Games: Operation: Casino,https://worldofescapes.com/montgomery/quests/breakout-montgomery-operation-casino
Alabama,Orange Beach,Breakout Games: Hostage,https://worldofescapes.com/gulf-shores/quests/breakout-orange-beach-hostage
Alabama,Orange Beach,Breakout Games: Operation: Casino,https://worldofescapes.com/gulf-shores/quests/breakout-orange-beach-operation-casino
Alabama,Orange Beach,Breakout Games: The Kidnapping,https://worldofescapes.com/gulf-shores/quests/breakout-orange-beach-the-kidnapping
Alabama,Orange Beach,Breakout Games: Island Escape,https://worldofescapes.com/gulf-shores/quests/breakout-orange-beach-island-escape
Alabama,Orange Beach,Breakout Games: Runaway Train,https://worldofescapes.com/gulf-shores/quests/breakout-orange-beach-runaway-train
Alabama,Orange Beach,Gulf Coast Escape Room:  Bates Motel,https://worldofescapes.com/gulf-shores/quests/gulf-coast-escape-room-bates-motel
Alabama,Orange Beach,XIT Escape Room: CSI: Gulf Shores,https://worldofescapes.com/gulf-shores/quests/xit-escape-room-csi-gulf-shores
Alabama,Orange Beach,XIT Escape Room: Movie Night,https://worldofescapes.com/gulf-shores/quests/xit-escape-room-movie-night
Alabama,Orange Beach,Escape House Waterville: The Hurricane Room,https://worldofescapes.com/gulf-shores/quests/escape-house-waterville-the-hurricane-room
Alabama,Orange Beach,Get a Clue: Crime Scene,https://worldofescapes.com/gulf-shores/quests/get-a-clue-crime-scene
Alabama,Orange Beach,Gulf Coast Escape Room: The Doll Room,https://worldofescapes.com/gulf-shores/quests/Gulf-Coast-Escape-Room-THE-DOLL-ROOM
Alabama,Orange Beach,Get a Clue: Mardi Gras,https://worldofescapes.com/gulf-shores/quests/get-a-clue-mardi-gras
Alabama,Orange Beach,Escape House Waterville: The Room of the Great Mysto,https://worldofescapes.com/gulf-shores/quests/escape-house-waterville-the-room-of-the-great-mysto
Alabama,Orange Beach,XIT Escape Room: Insane Asylum,https://worldofescapes.com/gulf-shores/quests/xit-escape-room-insane-asylum
Alabama,Orange Beach,Gulf Coast Escape Room: Zombie Autopsy,https://worldofescapes.com/gulf-shores/quests/Gulf-Coast-Escape-Room-ZOMBIE-LAB
Alabama,Orange Beach,XIT Escape Room: A Tale of Two Forts,https://worldofescapes.com/gulf-shores/quests/xit-escape-room-a-tale-of-two-forts
Alabama,Orange Beach,Get a Clue: Paranormal Investigation,https://worldofescapes.com/gulf-shores/quests/get-a-clue-paranormal-investigation
Alabama,Orange Beach,Gulf Coast Escape Room: The Voodoo Cabin,https://worldofescapes.com/gulf-shores/quests/gulf-coast-escape-room-gs-voodoo-cabin
Alabama,Oxford (AL),Escape Zone Oxford: The Golden Formula,https://worldofescapes.com/oxford-al/quests/escape-zone-oxford-the-golden-formula
Alabama,Oxford (AL),Escape Zone Oxford: The Bank Heist,https://worldofescapes.com/oxford-al/quests/escape-zone-oxford-the-bank-heist
Alabama,Oxford (AL),Escape Zone Oxford: Sulley’s Sinking Ship,https://worldofescapes.com/oxford-al/quests/escape-zone-oxford-sulleys-sinking-ship
Alabama,Tuscaloosa,Breakout Tuscaloosa: Horror Hotel,https://worldofescapes.com/tuscaloosa/quests/Horror-Hotel
Alabama,Tuscaloosa,Escape Tuscaloosa: The Playbook,https://worldofescapes.com/tuscaloosa/quests/escape-tuscaloosa-the-playbook
Alabama,Tuscaloosa,Escape Tuscaloosa: The Prison,https://worldofescapes.com/tuscaloosa/quests/escape-tuscaloosa-the-prison
Alabama,Tuscaloosa,Breakout Tuscaloosa: DeRailed,https://worldofescapes.com/tuscaloosa/quests/breakout-tuscaloosa-derailed
Alabama,Tuscaloosa,Escape Tuscaloosa: The Cabin,https://worldofescapes.com/tuscaloosa/quests/escape-tuscaloosa-the-cabin
Alabama,Tuscaloosa,Breakout Tuscaloosa: The Mission,https://worldofescapes.com/tuscaloosa/quests/breakout-tuscaloosa-the-mission
Alabama,Tuscaloosa,Escape Tuscaloosa: Abducted,https://worldofescapes.com/tuscaloosa/quests/escape-tuscaloosa-abducted
Alabama,Tuscaloosa,Escape Tuscaloosa: The Haunting,https://worldofescapes.com/tuscaloosa/quests/escape-tuscaloosa-the-haunted
Alabama,Tuscaloosa,ALL IN Adventures: Treasure Island,https://worldofescapes.com/tuscaloosa/quests/all-in-adventures-treasure-island
Alabama,Tuscaloosa,ALL IN Adventures: Escape From Alcatraz,https://worldofescapes.com/tuscaloosa/quests/all-in-adventures-escape-from-alcatraz
Alabama,Tuscaloosa,ALL IN Adventures: Sherlock’s Library,https://worldofescapes.com/tuscaloosa/quests/all-in-adventures-sherlocks-library
Alaska,Anchorage,Alaska Escape Rooms: Raven's Eye,https://worldofescapes.com/anchorage/quests/alaska-escape-rooms-ravens-eye
Alaska,Anchorage,Avalanche Escape Rooms: Blitzkrieg,https://worldofescapes.com/anchorage/quests/avalanche-escape-rooms-blitzkrieg
Alaska,Anchorage,Avalanche Escape Rooms: The Cure,https://worldofescapes.com/anchorage/quests/avalanche-escape-rooms-the-cure
Alaska,Anchorage,Escape Anchorage: Saloon No 10,https://worldofescapes.com/anchorage/quests/escape-anchorage-saloon-n-10
Alaska,Anchorage,ESCAPE! Alaska: The Tomb,https://worldofescapes.com/anchorage/quests/escape-alaska-the-tomb
Alaska,Anchorage,Avalanche Escape Rooms: It's Mine,https://worldofescapes.com/anchorage/quests/avalanche-escape-rooms-its-mine
Alaska,Anchorage,Escape Anchorage: Sanatorium,https://worldofescapes.com/anchorage/quests/escape-anchorage-sanatorium
Alaska,Fairbanks,Escape Room Ak: Operation: Blackout,https://worldofescapes.com/fairbanks/quests/escape-room-ak-operation-blackout
Alaska,Fairbanks,Escape Room Ak: Arctic Asylum,https://worldofescapes.com/fairbanks/quests/escape-room-ak-arctic-asylum
Alaska,Juneau,Escape Game Alaska: Sleeper Cell,https://worldofescapes.com/juneau/quests/escape-game-alaska-insanity
Alaska,Juneau,Escape Game Alaska: Espionage 2: Under Fire,https://worldofescapes.com/juneau/quests/escape-game-alaska-espionage-2-under-fire
Alaska,Juneau,Escape Game Alaska: Rowdy's Gold Claim,https://worldofescapes.com/juneau/quests/escape-game-alaska-rowdys-gold-claim
Alaska,Juneau,Escape Game Alaska: Espionage,https://worldofescapes.com/juneau/quests/escape-game-alaska-espionage
Arizona,Cottonwood,Constant Evolution Escape Rooms: Dead End,https://worldofescapes.com/cottonwood/quests/constant-evolution-escape-rooms-double-crossed
Arizona,Flagstaff,Flagstaff Escape Space: Jailbreak,https://worldofescapes.com/flagstaff/quests/flagstaff-escape-space-jailbreak
Arizona,Flagstaff,Flagstaff Escape Space: Saloon 66,https://worldofescapes.com/flagstaff/quests/flagstaff-escape-space-saloon-66
Arizona,Flagstaff,Xcape Flagstaff: The Da Vinci Code,https://worldofescapes.com/flagstaff/quests/xcape-flagstaff-the-da-vinci-code
Arizona,Flagstaff,Xcape Flagstaff: Overbrook Asylum,https://worldofescapes.com/flagstaff/quests/xcape-flagstaff-overbook-asylum
Arizona,Lake Havasu City,Gray Matter Escape: The Fallout Shelter,https://worldofescapes.com/lake-havasu-city/quests/gray-matter-escape-the-fallout-shelter
Arizona,Lake Havasu City,Gray Matter Escape: The Initiation,https://worldofescapes.com/lake-havasu-city/quests/gray-matter-escape-the-initiation
Arizona,Phoenix,Great Room Escape: Spellbound,https://worldofescapes.com/phoenix/quests/mindspark-escape-games-spellbound
Arizona,Phoenix,Dynamic Escape Rooms: The Secret Gallery (Quest to the Forbidden Temple),https://worldofescapes.com/phoenix/quests/dynamic-escape-rooms-the-secret-gallery-quest-to-the-forbidden-temple
Arizona,Phoenix,ESCAPE:chandler: Return of the Pharaohs,https://worldofescapes.com/phoenix/quests/paragon-escape-games-return-of-the-pharaohs
Arizona,Phoenix,Escape Rooms Mesa: Kate's Motel,https://worldofescapes.com/phoenix/quests/escape-chandler-kates-motel
Arizona,Phoenix,Escape Rooms Mesa: 51,https://worldofescapes.com/phoenix/quests/escape-rooms-mesa-51
Arizona,Phoenix,Escape Games AZ: Doll House,https://worldofescapes.com/phoenix/quests/escape-rooms-mesa-doll-house
Arizona,Phoenix,Dare to Escape AZ: The Bake Off,https://worldofescapes.com/phoenix/quests/escape-games-az-the-bake-off
Arizona,Phoenix,The Sleuth Box: The Cell,https://worldofescapes.com/phoenix/quests/dare-to-escape-az-the-cell
Arizona,Phoenix,Escape Games AZ: The Study,https://worldofescapes.com/phoenix/quests/the-study-az
Arizona,Phoenix,Lockdown Escape Rooms: Blaine's Basement,https://worldofescapes.com/phoenix/quests/escape-games-az-blaines-basement
Arizona,Phoenix,Epic Escape Game: Samurai,https://worldofescapes.com/phoenix/quests/lockdown-escape-rooms-samurai
Arizona,Phoenix,North Valley Escape Room: The Fortune Teller,https://worldofescapes.com/phoenix/quests/Epic-Escape-Game-The-Fortune-Teller
Arizona,Phoenix,Escape Zone: The Principal's Office,https://worldofescapes.com/phoenix/quests/north-valley-escape-room-the-principals-office
Arizona,Phoenix,Phoenix Puzzle Room: Rush Hour,https://worldofescapes.com/phoenix/quests/escape-zone-rush-hour
Arizona,Phoenix,Escape Zone: The Curse of Madame Lumina,https://worldofescapes.com/phoenix/quests/phoenix-puzzle-room-the-curse-of-madame-lumina
Arizona,Phoenix,Paradox Escape Room: Jail Break,https://worldofescapes.com/phoenix/quests/escape-zone-jail-break
Arizona,Phoenix,Inferno Escape Room: Casino Heist,https://worldofescapes.com/phoenix/quests/paradox-escape-room-casino-heist
Arizona,Phoenix,Puzzle Effect: Inventor's Secret,https://worldofescapes.com/phoenix/quests/inferno-escape-room-inventors-secret
Arizona,Phoenix,Cluemaster Escape Rooms: Pipe Works,https://worldofescapes.com/phoenix/quests/phoenix-escape-room-gilbert-pipe-works
Arizona,Phoenix,North Valley Escape Room: Creature of the Year,https://worldofescapes.com/phoenix/quests/cluemaster-escape-rooms-creature-of-the-year
Arizona,Phoenix,Phoenix Puzzle Room: The Great Outdoors,https://worldofescapes.com/phoenix/quests/north-valley-escape-room-the-great-outdoors
Arizona,Phoenix,Baffled Escape Rooms: The Pearled Pachyderm,https://worldofescapes.com/phoenix/quests/Phoenix-Puzzle-Room-The-Pearled-Pachyderm
Arizona,Phoenix,Epic Escape Game: Nuclear Meltdown,https://worldofescapes.com/phoenix/quests/baffled-escape-rooms-nuclear-meltdown
Arizona,Phoenix,North Valley Escape Room: Blood Thirst,https://worldofescapes.com/phoenix/quests/epic-escape-game-blood-thirst
Arizona,Phoenix,Escape Games AZ: Escape from Alcatraz,https://worldofescapes.com/phoenix/quests/north-valley-escape-room-escape-from-alcatraz
Arizona,Phoenix,Inferno Escape Room: The Condo,https://worldofescapes.com/phoenix/quests/escape-games-az-aunt-ednas-condo
Arizona,Phoenix,Escape Rooms Mesa: LIT,https://worldofescapes.com/phoenix/quests/inferno-escape-room-lit
Arizona,Phoenix,Escape Zone: The Legend of the Lost Dutchman,https://worldofescapes.com/phoenix/quests/escape-rooms-mesa-the-legend-of-the-lost-dutchman
Arizona,Phoenix,Lockdown Escape Rooms: The Inheritance,https://worldofescapes.com/phoenix/quests/escape-zone-the-inheritance
Arizona,Phoenix,Phoenix Puzzle Room: Chemical Lab,https://worldofescapes.com/phoenix/quests/lockdown-escape-rooms-chemical-lab
Arizona,Phoenix,Escape Rooms Mesa: Beta Labs,https://worldofescapes.com/phoenix/quests/phoenix-puzzle-room-beta-labs
Arizona,Phoenix,Inferno Escape Room: Captain's Quarters,https://worldofescapes.com/phoenix/quests/escape-rooms-mesa-captains-quarters
Arizona,Phoenix,Escape Westgate: Burned Out,https://worldofescapes.com/phoenix/quests/inferno-escape-room-burned-out
Arizona,Phoenix,Alcatraz Escape Games: The Lost Tomb,https://worldofescapes.com/phoenix/quests/escape-westgate-the-lost-tomb
Arizona,Phoenix,Puzzle Effect: The Row,https://worldofescapes.com/phoenix/quests/alcatraz-escape-games-the-row
Arizona,Phoenix,Alcatraz Escape Games: The Path,https://worldofescapes.com/phoenix/quests/the-puzzle-effect-phoenix-the-path
Arizona,Phoenix,Dare to Escape AZ: Zombie Panic,https://worldofescapes.com/phoenix/quests/alcatraz-escape-games-zombie-panic
Arizona,Phoenix,Puzzle Effect: The Cult of Mithras,https://worldofescapes.com/phoenix/quests/dare-to-escape-the-cult-of-mithras
Arizona,Phoenix,Escape Zone: Private Detective Agency: Knight & Rook Investigations,https://worldofescapes.com/phoenix/quests/phoenix-escape-room-gilbert-private-detective-agency
Arizona,Phoenix,Epic Escape Game: The Island,https://worldofescapes.com/phoenix/quests/escape-zone-az-the-island
Arizona,Phoenix,Eludesions Escape Rooms: Rogue Agent,https://worldofescapes.com/phoenix/quests/epic-escape-game-rogue-agent
Arizona,Phoenix,Escape the Room: Operation Counterpart,https://worldofescapes.com/phoenix/quests/eludesions-escape-rooms-operation-counterpart
Arizona,Phoenix,Phoenix Puzzle Room: The Submarine,https://worldofescapes.com/phoenix/quests/escape-the-room-az-the-submarine
Arizona,Phoenix,Escape Room 101: The Treasure of Captain Lockjaw,https://worldofescapes.com/phoenix/quests/phoenix-puzzle-room-the-treasure-of-captain-lockjaw
Arizona,Phoenix,Puzzle Effect: The Dragon Eggs Quest,https://worldofescapes.com/phoenix/quests/escape-room-101-the-dragon-eggs-quest
Arizona,Phoenix,ESCAPE:chandler: The Crimson Storm,https://worldofescapes.com/phoenix/quests/phoenix-escape-room-the-crimson-storm
Arizona,Phoenix,Key Quest: Tony's Bistro,https://worldofescapes.com/phoenix/quests/escape-chandler-tonys-bistro
Arizona,Phoenix,Escape the Room: Detention,https://worldofescapes.com/phoenix/quests/key-quest-phoenix-detention
Arizona,Phoenix,Escape Rooms Mesa: The Agency,https://worldofescapes.com/phoenix/quests/escape-the-room-az-the-agency
Arizona,Phoenix,ESCAPE:chandler: Carn-EVIL,https://worldofescapes.com/phoenix/quests/escape-rooms-mesa-carnevil
Arizona,Phoenix,Key Quest: Pawn Shop,https://worldofescapes.com/phoenix/quests/escape-chandler-pawn-shop
Arizona,Phoenix,Dare to Escape AZ: The Cellar,https://worldofescapes.com/phoenix/quests/Key-Quest-The-Cellar
Arizona,Phoenix,Eludesions Escape Rooms: Coma,https://worldofescapes.com/phoenix/quests/dare-to-escape-az-coma
Arizona,Phoenix,International Room Escape AZ: Runestone,https://worldofescapes.com/phoenix/quests/eludesions-escape-rooms-runestone
Arizona,Phoenix,Epic Escape Game: Amazon Rainforest,https://worldofescapes.com/phoenix/quests/international-room-escape-az-amazon-rainforest
Arizona,Phoenix,Escape Rooms Mesa: The Asylum,https://worldofescapes.com/phoenix/quests/epic-escape-game-phoenix-the-asylum
Arizona,Phoenix,Eludesions Escape Rooms: Outbreak!,https://worldofescapes.com/phoenix/quests/escape-rooms-mesa-outbreak
Arizona,Phoenix,Puzzle Effect: Case File: X,https://worldofescapes.com/phoenix/quests/eludesions-escape-rooms-case-file-x
Arizona,Phoenix,Eludesions Escape Rooms: Pipe Works,https://worldofescapes.com/phoenix/quests/the-puzzle-effect-phoenix-pipe-works
Arizona,Phoenix,Escape Narrative: Wicked Witch's Castle,https://worldofescapes.com/phoenix/quests/eludesions-escape-rooms-case-the-wicked-witchs-castle
Arizona,Phoenix,Escape House: The Story Room,https://worldofescapes.com/phoenix/quests/escape-narrative-the-story-room
Arizona,Phoenix,Dynamic Escape Rooms: The Detective's Office,https://worldofescapes.com/phoenix/quests/escape-house-mesa-the-detectives-office
Arizona,Phoenix,Escape House: The Time Machine: Nemesis,https://worldofescapes.com/phoenix/quests/dynamic-escape-rooms-nemesis
Arizona,Phoenix,North Valley Escape Room: Flood The City,https://worldofescapes.com/phoenix/quests/escape-house-mesa-flood-the-city
Arizona,Phoenix,Escape Westgate: The Legend of the 7th Stone,https://worldofescapes.com/phoenix/quests/north-valley-escape-room-the-legend-of-the-7th-stone
Arizona,Phoenix,Eludesions Escape Rooms: Terminator 2 Escape,https://worldofescapes.com/phoenix/quests/escape-westgate-terminator-2-escape
Arizona,Phoenix,Dare to Escape AZ: Mad Hatter,https://worldofescapes.com/phoenix/quests/eludesions-escape-rooms-mad-hatter
Arizona,Phoenix,North Valley Escape Room: The Shed,https://worldofescapes.com/phoenix/quests/dare-to-escape-az-the-shed
Arizona,Phoenix,Puzzle Effect: The Dark Sector,https://worldofescapes.com/phoenix/quests/north-valley-escape-room-the-dark-sector
Arizona,Phoenix,Dynamic Escape Rooms: Curse on the Emerald Seas,https://worldofescapes.com/phoenix/quests/the-puzzle-effect-phoenix-curse-on-the-emerald-seas
Arizona,Phoenix,Escape Rooms Mesa: The Time Machine: Deja Vu,https://worldofescapes.com/phoenix/quests/dynamic-escape-rooms-deja-vu
Arizona,Phoenix,Puzzling Escape: Zookeeper,https://worldofescapes.com/phoenix/quests/escape-rooms-mesa-zookeeper
Arizona,Phoenix,Escape Room 101: Nora's Nightmare,https://worldofescapes.com/phoenix/quests/puzzling-escape-noras-nightmare
Arizona,Phoenix,Puzzle Effect: Diplomat's Secret,https://worldofescapes.com/phoenix/quests/escape-room-101-diplomats-secret
Arizona,Phoenix,Escape Westgate: Amnesia,https://worldofescapes.com/phoenix/quests/phoenix-escape-room-gilbert-amnesia
Arizona,Phoenix,Alcatraz Escape Games: Bill and Ted's Excellent Escape Room,https://worldofescapes.com/phoenix/quests/escape-westgate-bill-and-teds-excellent-escape-room
