room_title,woe_room_url,review_id,review
"Escape room ""Lab Rats"" by 15 Locks in Austin",https://worldofescapes.com/austin/quests/15Locks-The-Window,0,"We did Lab Rats with a bunch of coworkers and it was exceptionally fun! The staff there is friendly, and the puzzles are interesting and promotes collaboration, which is what we were looking for for a work place team building activity. Highly recommend!!"
"Escape room ""Lab Rats"" by 15 Locks in Austin",https://worldofescapes.com/austin/quests/15Locks-The-Window,1,"Did ""Lab Rats"" with 12 other people and had a great time.  The room is so well designed and encouraged participation from everyone, not just a few dominant people.  The hour goes fast so everyone needs to be on their game."
"Escape room ""Lab Rats"" by 15 Locks in Austin",https://worldofescapes.com/austin/quests/15Locks-The-Window,2,It was an awesome experience my team had a blast. Fully recommend with 5 stars !
"Escape room ""Lab Rats"" by 15 Locks in Austin",https://worldofescapes.com/austin/quests/15Locks-The-Window,3,"This is a top of the line entertainment service. With perplexing puzzles, friendly service, and a reasonable price I will gladly make multiple trips through the coming years from Fort Worth in order to solve new rooms. The rooms provided are great for a date night or family outing."
"Escape room ""Lab Rats"" by 15 Locks in Austin",https://worldofescapes.com/austin/quests/15Locks-The-Window,4,"This place was awesome! Staff was great, puzzles required teamwork, and the locks were physically unique. Can't say enough about how great of an experience this was. Will be back for more!"
