room_title,woe_room_url,review_id,review
"Escape room ""Apartment 205"" by Enigma Escape Rooms in Los Angeles",https://worldofescapes.com/los-angeles/quests/apartment205-la,0,Awesome experience! Highly recommend. It was well thought out and provided a different experience than other room escapes. The story was great! Can't wait to do the other room!
"Escape room ""Apartment 205"" by Enigma Escape Rooms in Los Angeles",https://worldofescapes.com/los-angeles/quests/apartment205-la,1,Loads of fun! It's a challenging puzzle with live actors. We finished with only a minute to spare!
"Escape room ""Apartment 205"" by Enigma Escape Rooms in Los Angeles",https://worldofescapes.com/los-angeles/quests/apartment205-la,2,"Last day in LA , me and my film friends decided to be random and do the escape room. We underestimated the experience and it turned out to be great. The actor was great and the escape room was definitely challenging. We achieved it with 2 seconds left. Will definitely do this again. We did APT 205"
"Escape room ""Apartment 205"" by Enigma Escape Rooms in Los Angeles",https://worldofescapes.com/los-angeles/quests/apartment205-la,3,Nice birthday adventure! The staff was amazing!!!!
"Escape room ""Apartment 205"" by Enigma Escape Rooms in Los Angeles",https://worldofescapes.com/los-angeles/quests/apartment205-la,4,"I had a lot of fun with both their rooms, some clever clues and fantastic puzzles they got."
"Escape room ""Apartment 205"" by Enigma Escape Rooms in Los Angeles",https://worldofescapes.com/los-angeles/quests/apartment205-la,5,"Celebrated my birthday by doing the Secret Temple room. Amazing. Very fun. Without any spoilers, I can say they made my birthday very special. Can't wait to come back for the other rooms!!"
"Escape room ""Apartment 205"" by Enigma Escape Rooms in Los Angeles",https://worldofescapes.com/los-angeles/quests/apartment205-la,6,"So far I have done 6 Escape Rooms, and Enigma provided the best options BY FAR! Can't wait to go back for their third room! A great way to spend time with friends and family!"
