room_title,woe_room_url,review_id,review
"Escape room ""Mystery Mansion"" by Breakout Games - Dayton in Dayton",https://worldofescapes.com/dayton/quests/breakout-games-dayton-mystery-mansion,0,"Awesome experience! We did the Mystery Mansion room, and made it through with five minutes to spare. Great atmosphere, engaging clues without being overly complicated, I look forward to doing the other rooms here. The staff was super friendly and added to the immersion. 6 out of 5 stars."
"Escape room ""Mystery Mansion"" by Breakout Games - Dayton in Dayton",https://worldofescapes.com/dayton/quests/breakout-games-dayton-mystery-mansion,1,"Was a great experience all around. Appreciated that I was able to split my group into two equal sized groups of 7, instead of the 8 in one room and 6 in another, that I had booked. Courtney did an amazing job as a GM, and Mystery Mansion was well produced and original."
"Escape room ""Mystery Mansion"" by Breakout Games - Dayton in Dayton",https://worldofescapes.com/dayton/quests/breakout-games-dayton-mystery-mansion,2,Great day! We did the Haunted Mansion and having done other escape rooms is various cities this one was by far more challenging. LOTS of detail and communication is key. But we had a great time even though we didn’t escape in time.
"Escape room ""Mystery Mansion"" by Breakout Games - Dayton in Dayton",https://worldofescapes.com/dayton/quests/breakout-games-dayton-mystery-mansion,3,We had a blast! April was a great guide. We broke out of the Mystery Mansion with 49 seconds to spare. Will definitely do another room!
"Escape room ""Mystery Mansion"" by Breakout Games - Dayton in Dayton",https://worldofescapes.com/dayton/quests/breakout-games-dayton-mystery-mansion,4,We did the Mystery Mansion and loved it!! It was my first time there but won't be my last!
