room_title,woe_room_url,review_id,review
"Escape room ""The Professor's Study"" by Endeavor Escape Rooms in South Bend",https://worldofescapes.com/south-bend/quests/endeavor-escape-rooms-the-professors-study,0,Awesome escape room experience. Creative puzzles that were both fun and challenging. Most affordable option in the area of the three that offer escape rooms and by far the best in the area.
"Escape room ""The Professor's Study"" by Endeavor Escape Rooms in South Bend",https://worldofescapes.com/south-bend/quests/endeavor-escape-rooms-the-professors-study,1,"This room was cleverly constructed with interesting puzzles. I would highly recommend this place to anyone looking for a challenging escape room experience. Also, you can't beat the price of this place. Well worth the cost."
"Escape room ""The Professor's Study"" by Endeavor Escape Rooms in South Bend",https://worldofescapes.com/south-bend/quests/endeavor-escape-rooms-the-professors-study,2,"Can’t wait to come back for the second room once construction is finished! This escape room was wonderfully planned out with many levels to crack within each room. At a great price, you can’t beat it!"
"Escape room ""The Professor's Study"" by Endeavor Escape Rooms in South Bend",https://worldofescapes.com/south-bend/quests/endeavor-escape-rooms-the-professors-study,3,"Well constructed and exciting problems to solve! Not impossible to complete in an hour. Garrett, the owner, is awesome, and I can't wait to see what other rooms he adds!"
"Escape room ""The Professor's Study"" by Endeavor Escape Rooms in South Bend",https://worldofescapes.com/south-bend/quests/endeavor-escape-rooms-the-professors-study,4,"Had a GREAT time doing this with friends. If you're looking for an experience that will test your physical and mental abilities, as well as your patience, I highly recommend stopping by and giving this a try. Grab a few close friends and see if you've got what it takes to escape this mind boggling endeavor."
