room_title,woe_room_url,review_id,review
"Escape room ""The Crypt"" by Escape New Haven in New Haven",https://worldofescapes.com/new-haven/quests/Escape-New-Haven-The-Crypt,0,"What a good time. Just had a game with three others in ""The Crypt"". It was really challenging but also fun. It was different but great. From the moment I walked in, I felt welcomed, the staff was friendly and inviting and helpful. I recommend this place to any and all who want to try it!"
"Escape room ""The Crypt"" by Escape New Haven in New Haven",https://worldofescapes.com/new-haven/quests/Escape-New-Haven-The-Crypt,1,Played the crypt with 2 other people and it was awesome! Highly recommend.
"Escape room ""The Crypt"" by Escape New Haven in New Haven",https://worldofescapes.com/new-haven/quests/Escape-New-Haven-The-Crypt,2,"Had a great time trying to escape 'The Crypt'. Interesting, challenging puzzles with a unique story line."
"Escape room ""The Crypt"" by Escape New Haven in New Haven",https://worldofescapes.com/new-haven/quests/Escape-New-Haven-The-Crypt,3,"We went yesterday and try the ""Crypt"". It was awesome and totally exhilarating and we had a lot of fun. Genius! Unfortunately, we didn't make it out on time . We shall return!"
"Escape room ""The Crypt"" by Escape New Haven in New Haven",https://worldofescapes.com/new-haven/quests/Escape-New-Haven-The-Crypt,4,Best hour you can spend with your friends locked in a room.
