room_title,woe_room_url,review_id,review
"Escape room ""The Cellar"" by Hawaii Escape Challenge in Honolulu",https://worldofescapes.com/honolulu/quests/hawaii-escape-challenge-the-cellar,0,I love this place! The people are so nice and I had fun! It is expensive but I know that I will be spending more money there in the future! I heard people screaming from the cellar so if you want to get scared then choose the cellar!
"Escape room ""The Cellar"" by Hawaii Escape Challenge in Honolulu",https://worldofescapes.com/honolulu/quests/hawaii-escape-challenge-the-cellar,1,"The Cellar at Pearlridge Mall was so much fun! The entire family had a blast. We got close but didn't escape. If only we had 15 more mins. Think fast, work together, and remember every minute counts. We are addicted and will definitely come back again. I highly recommend The Cellar."
"Escape room ""The Cellar"" by Hawaii Escape Challenge in Honolulu",https://worldofescapes.com/honolulu/quests/hawaii-escape-challenge-the-cellar,2,"It was exciting from beginning to end and our team broke the record for The Cellar! Our game master was awesome and the cast was amazing. I can't recommend highly enough if you're looking for something different to do. Thanks so much, you guys!"
"Escape room ""The Cellar"" by Hawaii Escape Challenge in Honolulu",https://worldofescapes.com/honolulu/quests/hawaii-escape-challenge-the-cellar,3,I was super skeptical but had a blast overall. My heart is still racing. We beat The Cellar with 7 minutes to spare!
"Escape room ""The Cellar"" by Hawaii Escape Challenge in Honolulu",https://worldofescapes.com/honolulu/quests/hawaii-escape-challenge-the-cellar,4,"We had such a GREAT time. Awesome, friendly, helpful staff, very exciting escape rooms, surprises at every turn, a definite must do!"
