room_title,woe_room_url,review_id,review
"Escape room ""Wise Guys"" by Planet Escape Room in Los Angeles",https://worldofescapes.com/los-angeles/quests/planet-escape-room-wiseguys,0,I have a lots of fun. HUNTER the guy that guide me and my friend was very helpful and nice!! I truly recommend it. Thank you!!! I will come back for the next level!! I am from Las Vegas!! 🤗
"Escape room ""Wise Guys"" by Planet Escape Room in Los Angeles",https://worldofescapes.com/los-angeles/quests/planet-escape-room-wiseguys,1,We had a mind-blowing experience. Allen our host did a superb job getting us ready for our 60-minute adventure. The clues were challenging and not obvious. We got a preview of escape rooms being constructed. Heartily recommend the escape room for a unique outing. 
"Escape room ""Wise Guys"" by Planet Escape Room in Los Angeles",https://worldofescapes.com/los-angeles/quests/planet-escape-room-wiseguys,2,"Fun staff, good times with friends. We did the mafia one and it was pretty intense. WE WERE SO CLOSE! Compared to the competition, one of the better escape rooms out there."
"Escape room ""Wise Guys"" by Planet Escape Room in Los Angeles",https://worldofescapes.com/los-angeles/quests/planet-escape-room-wiseguys,3,This is by far the best escape room around. Just when you believe you've got it - think again! The best part? Completely a private experience. Went here for a date night and left with all smiles. Thank you so much!
"Escape room ""Wise Guys"" by Planet Escape Room in Los Angeles",https://worldofescapes.com/los-angeles/quests/planet-escape-room-wiseguys,4,I’ve done a lot of escape rooms and this one is at the top of the list. It was very creative and super fun. Loved the way the room was set up and had some creative surprises! Highly recommend two thumbs up!
