room_title,woe_room_url,review_id,review
"Escape room ""Zoe’s Torment"" by Pursue the Clue in Albany",https://worldofescapes.com/albany/quests/pursue-the-clue-zoes-torment,0,Super fun and scary adventure. My “friend” and I solved the mystery of Zoe’s Torment tonight. The story and puzzles were great it had us screaming and hesitant to touch or open anything! The owner was a great host and kept things lively.
"Escape room ""Zoe’s Torment"" by Pursue the Clue in Albany",https://worldofescapes.com/albany/quests/pursue-the-clue-zoes-torment,1,We were there last night with friends and had a fantastic time solving Zoe’s Torment. The staff was great and we loved chatting with them afterwards about the room! One person with us has done a ton of escape rooms and works at one of them all venues he says this is one of the best ones he’s ever been to.
"Escape room ""Zoe’s Torment"" by Pursue the Clue in Albany",https://worldofescapes.com/albany/quests/pursue-the-clue-zoes-torment,2,"Fantastic customer service, the horror room was challenging, interesting, and gave us a few scares. I can't wait for them to offer more rooms and believe that it is by far the best room in the capital region."
"Escape room ""Zoe’s Torment"" by Pursue the Clue in Albany",https://worldofescapes.com/albany/quests/pursue-the-clue-zoes-torment,3,Did the “Zoe’s Torment” room today and had a ton of fun!! I would definitely recommend it!
"Escape room ""Zoe’s Torment"" by Pursue the Clue in Albany",https://worldofescapes.com/albany/quests/pursue-the-clue-zoes-torment,4,Had a fantastic time this afternoon. Would highly recommend this place. We did Zoe’s Torment.
