room_title,woe_room_url,review_id,review
"Escape room ""Mysterious Stranger"" by Steal and Escape in San Diego",https://worldofescapes.com/san-diego/quests/Steal-and-Escape-Mysterious-Stranger,0,Wow! What a fun and challenging room! Denzel was extremely nice and helpful! He let us know about the other room option and will be back again very soon! 
"Escape room ""Mysterious Stranger"" by Steal and Escape in San Diego",https://worldofescapes.com/san-diego/quests/Steal-and-Escape-Mysterious-Stranger,1,"Fantastic gameplay, well thought out theme, and immersive decor. The owner, Jason was encouraging and his fun demeanor was contagious. Anyone in the San Diego area must come try!"
"Escape room ""Mysterious Stranger"" by Steal and Escape in San Diego",https://worldofescapes.com/san-diego/quests/Steal-and-Escape-Mysterious-Stranger,2,"Had a wonderful time with my escape room team! This was my 25th room and my teams 7th and it certainly didn’t disappoint. Loved the room, wonderful immersion, unique puzzles and passionate owners who love what they do. Couldn’t ask for anything more!"
"Escape room ""Mysterious Stranger"" by Steal and Escape in San Diego",https://worldofescapes.com/san-diego/quests/Steal-and-Escape-Mysterious-Stranger,3,This was definately the best way to spend a friday afternoon! Very challenging and rewarding! Owner is the nicest and you can tell he really enjoys his job! Makes the expierence that much better!  
"Escape room ""Mysterious Stranger"" by Steal and Escape in San Diego",https://worldofescapes.com/san-diego/quests/Steal-and-Escape-Mysterious-Stranger,4,"Mysterious Stranger room - Played the escape room with 2 of my escape room partners in crime. The set and prop designs are beautiful, the flow of the game was smooth, and the transitions between the zones adhered and added to the story line. This has to be one of the top escape rooms in San Diego!"
"Escape room ""Mysterious Stranger"" by Steal and Escape in San Diego",https://worldofescapes.com/san-diego/quests/Steal-and-Escape-Mysterious-Stranger,5,This is a fabulous room well designed and great hospitality!!
