room_title,woe_room_url,review_id,review
"Escape room ""The Gallery"" by The Room Lisle in Chicago",https://worldofescapes.com/chicago/quests/the-room-lisle-the-gallery-room,0,This was so much fun! Definetely coming and doing the other room!
"Escape room ""The Gallery"" by The Room Lisle in Chicago",https://worldofescapes.com/chicago/quests/the-room-lisle-the-gallery-room,1,It was fun. Definitely worth the money. Now I think I want to try other rooms in the area.
"Escape room ""The Gallery"" by The Room Lisle in Chicago",https://worldofescapes.com/chicago/quests/the-room-lisle-the-gallery-room,2,We had such a blast!! Best adult night out!! Can't wait to come back to try the other room!!
"Escape room ""The Gallery"" by The Room Lisle in Chicago",https://worldofescapes.com/chicago/quests/the-room-lisle-the-gallery-room,3,Great place. Had so much fun. Can't wait to do it again.
"Escape room ""The Gallery"" by The Room Lisle in Chicago",https://worldofescapes.com/chicago/quests/the-room-lisle-the-gallery-room,4,"It is so much fun. You have to be super quick witted and you have to work as a team. If you find multiple clues, you need to work together because if someone is out of the loop, you won't figure it out. I have been to both the Einstein room and the Gallery and both were super fun!"
"Escape room ""The Gallery"" by The Room Lisle in Chicago",https://worldofescapes.com/chicago/quests/the-room-lisle-the-gallery-room,5,GREAT time! I can't wait to try The Einstein Room next!
"Escape room ""The Gallery"" by The Room Lisle in Chicago",https://worldofescapes.com/chicago/quests/the-room-lisle-the-gallery-room,6,This is an AWESOME experience!! We loved it!! We escaped the Gallery with our two teenage sons 
