room_title,woe_room_url,review_id,review
"Escape room ""Hoosier Hysteria"" by The Escape Room Indianapolis in Indianapolis",https://worldofescapes.com/indianapolis/quests/the-escape-room-indianapolis-hoosier-hysteria,0,Hoosier Hysteria room was fun. Coco was the best!
"Escape room ""Hoosier Hysteria"" by The Escape Room Indianapolis in Indianapolis",https://worldofescapes.com/indianapolis/quests/the-escape-room-indianapolis-hoosier-hysteria,1,"This place is a blast! We had a group of 8 for the Hoosier Hysteria room. Our team was great and we escaped with 12:30 on the clock. Not bad for first timers, I guess. I would definitely do this again. Thank you for a great experience!"
"Escape room ""Hoosier Hysteria"" by The Escape Room Indianapolis in Indianapolis",https://worldofescapes.com/indianapolis/quests/the-escape-room-indianapolis-hoosier-hysteria,2,"We had a great time in the Hoosier hysteria room! Our group included three 10 year old boys who throughly enjoyed the entire experience, along with the adults. Ellen was our awesome guide, she was super encouraging and fun! We will definitely be back!"
"Escape room ""Hoosier Hysteria"" by The Escape Room Indianapolis in Indianapolis",https://worldofescapes.com/indianapolis/quests/the-escape-room-indianapolis-hoosier-hysteria,3,We did this for a work/team outing. It was really fun! I want to tell Scott that Shelby was an awesome group leader! :)
"Escape room ""Hoosier Hysteria"" by The Escape Room Indianapolis in Indianapolis",https://worldofescapes.com/indianapolis/quests/the-escape-room-indianapolis-hoosier-hysteria,4,Our law firm went there for our Christmas party and we had a great time. We broke up into groups and did all of the rooms. Our room advisor was Brenna who was wonderful. I would highly recommend The Escape Room for office parties and Brenna as your room advisor. Can't wait to come back.
