room_title,woe_room_url,review_id,review
"Escape room ""CDC Lockdown"" by Urban Escape Games in Atlanta",https://worldofescapes.com/atlanta/quests/urban-escape-games-cdc-lockdown,0,"What an amazing experience he had at urban escape. Innovative,entertaining, teamwork, challenge and above all fun. A must do activity for all"
"Escape room ""CDC Lockdown"" by Urban Escape Games in Atlanta",https://worldofescapes.com/atlanta/quests/urban-escape-games-cdc-lockdown,1,So much fun! Highly recommend for families or groups of friends!
"Escape room ""CDC Lockdown"" by Urban Escape Games in Atlanta",https://worldofescapes.com/atlanta/quests/urban-escape-games-cdc-lockdown,2,I can not say enough great things about our experience at Urban Escape! The room was equally fun and challenging and the staff is amazing and so friendly! My group of friends and I are looking forward to going back very soon!
"Escape room ""CDC Lockdown"" by Urban Escape Games in Atlanta",https://worldofescapes.com/atlanta/quests/urban-escape-games-cdc-lockdown,3,"Step aside, Sudoku. Catch you later, Crossword. I've found my new favorite puzzle game.Great upbeat, helpful staff. Highly recommend for team building. If you are competitive like me, you will be challenged by the clock. I already knew I was a puzzle person going into the CDC and Jewel Heist games, but I think I might have just found a dangerously addictive new hobby..."
"Escape room ""CDC Lockdown"" by Urban Escape Games in Atlanta",https://worldofescapes.com/atlanta/quests/urban-escape-games-cdc-lockdown,4,We're visiting family here from Ireland and we played this yesterday and it was so much fun! Such a clever idea! CDC room was amazing! So creative! Game master was awesome all the staff were so friendly. Can't wait to come back again! Bring it to Ireland please
"Escape room ""CDC Lockdown"" by Urban Escape Games in Atlanta",https://worldofescapes.com/atlanta/quests/urban-escape-games-cdc-lockdown,5,"My wife and I had a great time. We were grouped with two other couples (all strangers to each other) for the CDC experience. Despite not knowing anybody, we all had fun together and managed to escape in time. Ellis was our game master and did a fantastic job. All the staff were friendly, enthusiastic, helpful, and you could tell they enjoyed their work."
"Escape room ""CDC Lockdown"" by Urban Escape Games in Atlanta",https://worldofescapes.com/atlanta/quests/urban-escape-games-cdc-lockdown,6,"One of the best ""things to do"" in The Alpharetta area.Want to have fun with 7 of your closest friends?  Want to meet up to 7 new friends?  Want to work together to build a team or to strengthen relationships?  Urban Escapes is the place.$28 bucks.  1 hour.  Go.  You'll have fun."
