room_title,woe_room_url,review_id,review
"Escape room ""Dorm Room Daze"" by Urban Enigmas in Athens",https://worldofescapes.com/athens/quests/urban-enigmas-dorm-room-daze,0,Such a fun place! We did the Dorm Room Daze and made it out! Jackson was a wonderful host!
"Escape room ""Dorm Room Daze"" by Urban Enigmas in Athens",https://worldofescapes.com/athens/quests/urban-enigmas-dorm-room-daze,1,Did the dorm daze room and it took us the full time limit to figure it out. It was a blast and definitely a challenge.
"Escape room ""Dorm Room Daze"" by Urban Enigmas in Athens",https://worldofescapes.com/athens/quests/urban-enigmas-dorm-room-daze,2,Excellent job with the Dorm room. Had an amazing time and the puzzle was challenging yet engaging. 5 Stars and 2 thumbs up. Would highly recommend to everyone. The future rooms sound wonderful.
"Escape room ""Dorm Room Daze"" by Urban Enigmas in Athens",https://worldofescapes.com/athens/quests/urban-enigmas-dorm-room-daze,3,Excellent job with the Dorm room. Had an amazing time and the puzzle was challenging yet engaging. 5 Stars and 2 thumbs up. Would highly recommend to everyone. The future rooms sound wonderful.
"Escape room ""Dorm Room Daze"" by Urban Enigmas in Athens",https://worldofescapes.com/athens/quests/urban-enigmas-dorm-room-daze,4,"Very fun! We did Dorm Room with kids from age 8-14. They did most of the work, had a great time and escaped the room. Friendly, helpful staff!"
