room_title,woe_room_url,review_id,review
"Escape room ""Steampunk 2.0"" by Xcape Adventures in Dallas-Fort Worth",https://worldofescapes.com/dallas/quests/xcape-adventures-steampunk,0,Wow what a ton of fun. We beat the Steampunk room with ten minutes to spare! Then for the rest of the night about half our conversations were about how much fun the room was. Really want to try the retro arcade/Pixels room. Great time.
"Escape room ""Steampunk 2.0"" by Xcape Adventures in Dallas-Fort Worth",https://worldofescapes.com/dallas/quests/xcape-adventures-steampunk,1,Took my family to the Steampunk room. We had so much fun we stayed and did the Game Over room too. Great family-friendly fun!!!
"Escape room ""Steampunk 2.0"" by Xcape Adventures in Dallas-Fort Worth",https://worldofescapes.com/dallas/quests/xcape-adventures-steampunk,2,"My husband and I did a room, just the two of us. We were worried there'd be no way we could do it but we finished with a couple minutes to spare. It was so much fun, challenging but doable. It was a birthday surprise for me and I loved it!"
"Escape room ""Steampunk 2.0"" by Xcape Adventures in Dallas-Fort Worth",https://worldofescapes.com/dallas/quests/xcape-adventures-steampunk,3,My family and I did the Steam Punk escape room Thanksgiving Weekend 2015. We had a great time! I've done a few different puzzle rooms before but the props and systems in the Steam Punk Room were better than anything I've ever experienced. Fantastic quality and detail. Worth the money!
"Escape room ""Steampunk 2.0"" by Xcape Adventures in Dallas-Fort Worth",https://worldofescapes.com/dallas/quests/xcape-adventures-steampunk,4,"This place is wonderful! We'd gone to another escape room in town, but Xcape beat them hands-down for creativity and fun. The staff are friendly, organized. .. my family and I had a Great time!"
"Escape room ""Steampunk 2.0"" by Xcape Adventures in Dallas-Fort Worth",https://worldofescapes.com/dallas/quests/xcape-adventures-steampunk,5,Wow what a ton of fun. We beat the Steampunk room with ten minutes to spare! Then for the rest of the night about half our conversations were about how much fun the room was. Really want to try the retro arcade/Pixels room. Great time.
"Escape room ""Steampunk 2.0"" by Xcape Adventures in Dallas-Fort Worth",https://worldofescapes.com/dallas/quests/xcape-adventures-steampunk,6,"My husband and I did a room, just the two of us. We were worried there'd be no way we could do it but we finished with a couple minutes to spare. It was so much fun, challenging but doable. It was a birthday surprise for me and I loved it!"
