room_title,woe_room_url,room_address,room_description,player_range,time_limit,difficulty_level,fear_level,age_requirement,success_rate
"Escape room ""Alice In Wonderland"" by River City Escape Room in Richmond (VA)",https://worldofescapes.com/richmond-v-a/quests/river-city-escape-room-alice-in-wonderland,"8047 West Broad Street Richmond, VA 23294","Sliding into Wonderland trapped and all alone…
The steps you take are perilous with clues not easily shown.
Your reality is different than ours, as time employs its wrath.
Whether growing big or shrinking small, follow the un-logical path.
All we know of this mad world is the Queen rules the day.
She must be pleased to leave Wonderland or else you all must stay!",2-6,60,Average,Not scary,10+,None
